PRODUCT_ID,PRODUCT_NAME,CATEGORY,SUB_CATEGORY
FUR-FU-10004415,"Stacking Tray, Side-Loading, Legal, Smoke",FURNITURE,Furnishings
FUR-FU-10004460,"Howard Miller 12"" Round Wall Clock",FURNITURE,Furnishings
FUR-FU-10004586,G.E. Longer-Life Indoor Recessed Floodlight Bulbs,FURNITURE,Furnishings
FUR-FU-10004587,"GE General Use Halogen Bulbs, 100 Watts, 1 Bulb per Pack",FURNITURE,Furnishings
FUR-FU-10004597,Eldon Cleatmat Chair Mats for Medium Pile Carpets,FURNITURE,Furnishings
FUR-FU-10004622,Eldon Advantage Foldable Chair Mats for Low Pile Carpets,FURNITURE,Furnishings
FUR-FU-10004665,"3M Polarizing Task Lamp with Clamp Arm, Light Gray",FURNITURE,Furnishings
FUR-FU-10004666,DAX Clear Channel Poster Frame,FURNITURE,Furnishings
FUR-FU-10004671,"Executive Impressions 12"" Wall Clock",FURNITURE,Furnishings
FUR-FU-10004712,"Westinghouse Mesh Shade Clip-On Gooseneck Lamp, Black",FURNITURE,Furnishings
FUR-FU-10004748,"Howard Miller 16"" Diameter Gallery Wall Clock",FURNITURE,Furnishings
FUR-FU-10004845,"Deflect-o EconoMat Nonstudded, No Bevel Mat",FURNITURE,Furnishings
FUR-FU-10004848,"Howard Miller 13-3/4"" Diameter Brushed Chrome Round Wall Clock",FURNITURE,Furnishings
FUR-FU-10004848,DAX Solid Wood Frames,FURNITURE,Furnishings
FUR-FU-10004864,"Howard Miller 14-1/2"" Diameter Chrome Round Wall Clock",FURNITURE,Furnishings
FUR-FU-10004864,Eldon 500 Class Desk Accessories,FURNITURE,Furnishings
FUR-FU-10004904,"Eldon ""L"" Workstation Diamond Chairmat",FURNITURE,Furnishings
FUR-FU-10004909,Contemporary Wood/Metal Frame,FURNITURE,Furnishings
FUR-FU-10004952,"C-Line Cubicle Keepers Polyproplyene Holder w/Velcro Back, 8-1/2x11, 25/Bx",FURNITURE,Furnishings
FUR-FU-10004960,"Seth Thomas 12"" Clock w/ Goldtone Case",FURNITURE,Furnishings
FUR-FU-10004963,"Eldon 400 Class Desk Accessories, Black Carbon",FURNITURE,Furnishings
FUR-FU-10004973,Flat Face Poster Frame,FURNITURE,Furnishings
FUR-HON-10000224,"Hon Computer Table, with Bottom Storage",FURNITURE,Tables
FUR-HON-10001015,"Hon Training Table, Rectangular",FURNITURE,Tables
FUR-HON-10001343,"Hon Coffee Table, Fully Assembled",FURNITURE,Tables
FUR-HON-10001960,"Hon Wood Table, Rectangular",FURNITURE,Tables
FUR-HON-10002837,"Hon Round Table, with Bottom Storage",FURNITURE,Tables
FUR-HON-10003080,"Hon Computer Table, Adjustable Height",FURNITURE,Tables
FUR-HON-10003412,"Hon Wood Table, Fully Assembled",FURNITURE,Tables
FUR-HON-10003871,"Hon Conference Table, Fully Assembled",FURNITURE,Tables
FUR-HON-10003950,"Hon Coffee Table, Adjustable Height",FURNITURE,Tables
FUR-HON-10004932,"Hon Conference Table, with Bottom Storage",FURNITURE,Tables
FUR-HON-10004987,"Hon Training Table, Adjustable Height",FURNITURE,Tables
FUR-LES-10000488,"Lesro Coffee Table, Adjustable Height",FURNITURE,Tables
FUR-LES-10000874,"Lesro Computer Table, Fully Assembled",FURNITURE,Tables
FUR-LES-10000904,"Lesro Training Table, with Bottom Storage",FURNITURE,Tables
FUR-LES-10002026,"Lesro Conference Table, Rectangular",FURNITURE,Tables
FUR-LES-10002613,"Lesro Wood Table, Rectangular",FURNITURE,Tables
FUR-LES-10002616,"Lesro Conference Table, with Bottom Storage",FURNITURE,Tables
FUR-LES-10002852,"Lesro Computer Table, Adjustable Height",FURNITURE,Tables
FUR-LES-10003082,"Lesro Coffee Table, Rectangular",FURNITURE,Tables
FUR-LES-10003538,"Lesro Coffee Table, Fully Assembled",FURNITURE,Tables
FUR-LES-10004098,"Lesro Round Table, Rectangular",FURNITURE,Tables
FUR-LES-10004420,"Lesro Coffee Table, with Bottom Storage",FURNITURE,Tables
FUR-LES-10004886,"Lesro Conference Table, Fully Assembled",FURNITURE,Tables
FUR-TA-10000022,"Hon Conference Table, Adjustable Height",FURNITURE,Tables
FUR-TA-10000038,"Chromcraft Conference Table, Adjustable Height",FURNITURE,Tables
FUR-TA-10000075,"Bevis Coffee Table, Fully Assembled",FURNITURE,Tables
FUR-TA-10000164,"Lesro Training Table, Fully Assembled",FURNITURE,Tables
FUR-TA-10000184,"Barricks Conference Table, Fully Assembled",FURNITURE,Tables
FUR-TA-10000198,Chromcraft Bull-Nose Wood Oval Conference Tables & Bases,FURNITURE,Tables
FUR-TA-10000207,"Chromcraft Round Table, Fully Assembled",FURNITURE,Tables
FUR-TA-10000222,"Bevis Training Table, Adjustable Height",FURNITURE,Tables
FUR-TA-10000283,"Hon Wood Table, with Bottom Storage",FURNITURE,Tables
FUR-TA-10000299,"Lesro Round Table, Adjustable Height",FURNITURE,Tables
FUR-TA-10000317,"Barricks Computer Table, Fully Assembled",FURNITURE,Tables
FUR-TA-10000323,"Lesro Round Table, Fully Assembled",FURNITURE,Tables
FUR-TA-10000403,"Barricks Wood Table, Adjustable Height",FURNITURE,Tables
FUR-TA-10000478,"Bevis Round Table, Fully Assembled",FURNITURE,Tables
FUR-TA-10000577,Bretford CR4500 Series Slim Rectangular Table,FURNITURE,Tables
FUR-TA-10000591,"Chromcraft Training Table, with Bottom Storage",FURNITURE,Tables
FUR-TA-10000593,"Chromcraft Training Table, Fully Assembled",FURNITURE,Tables
FUR-TA-10000617,"Hon Practical Foundations 30 x 60 Training Table, Light Gray/Charcoal",FURNITURE,Tables
FUR-TA-10000671,"Barricks Conference Table, with Bottom Storage",FURNITURE,Tables
FUR-TA-10000688,"Chromcraft Bull-Nose Wood Round Conference Table Top, Wood Base",FURNITURE,Tables
FUR-TA-10000750,"Hon Round Table, Fully Assembled",FURNITURE,Tables
FUR-TA-10000805,"Bevis Wood Table, Adjustable Height",FURNITURE,Tables
FUR-TA-10000849,Bevis Rectangular Conference Tables,FURNITURE,Tables
FUR-TA-10000855,"Chromcraft Training Table, Rectangular",FURNITURE,Tables
FUR-TA-10000945,"Bevis Coffee Table, Adjustable Height",FURNITURE,Tables
FUR-TA-10000963,"Chromcraft Round Table, with Bottom Storage",FURNITURE,Tables
FUR-TA-10000971,"Bevis Training Table, Rectangular",FURNITURE,Tables
FUR-TA-10001039,KI Adjustable-Height Table,FURNITURE,Tables
FUR-TA-10001056,"Barricks Conference Table, Adjustable Height",FURNITURE,Tables
FUR-TA-10001086,"SAFCO PlanMaster Boards, 60w x 37-1/2d, White Melamine",FURNITURE,Tables
FUR-TA-10001095,Chromcraft Round Conference Tables,FURNITURE,Tables
FUR-TA-10001100,"Lesro Training Table, Adjustable Height",FURNITURE,Tables
FUR-TA-10001192,"Hon Training Table, Fully Assembled",FURNITURE,Tables
FUR-TA-10001205,"Chromcraft Wood Table, Rectangular",FURNITURE,Tables
FUR-TA-10001226,"Hon Conference Table, Rectangular",FURNITURE,Tables
FUR-TA-10001229,"Chromcraft Computer Table, Rectangular",FURNITURE,Tables
FUR-TA-10001285,"Chromcraft Conference Table, Fully Assembled",FURNITURE,Tables
FUR-TA-10001306,"Hon Wood Table, Adjustable Height",FURNITURE,Tables
FUR-TA-10001307,"SAFCO PlanMaster Heigh-Adjustable Drafting Table Base, 43w x 30d x 30-37h, Black",FURNITURE,Tables
FUR-TA-10001360,"Bevis Round Table, Rectangular",FURNITURE,Tables
FUR-TA-10001371,"Chromcraft Coffee Table, Fully Assembled",FURNITURE,Tables
FUR-TA-10001433,"Bevis Round Table, with Bottom Storage",FURNITURE,Tables
FUR-TA-10001494,"Lesro Wood Table, Adjustable Height",FURNITURE,Tables
FUR-TA-10001520,"Lesro Sheffield Collection Coffee Table, End Table, Center Table, Corner Table",FURNITURE,Tables
FUR-TA-10001539,Chromcraft Rectangular Conference Tables,FURNITURE,Tables
FUR-TA-10001549,"Barricks Coffee Table, Rectangular",FURNITURE,Tables
FUR-TA-10001602,"Barricks Round Table, Adjustable Height",FURNITURE,Tables
FUR-TA-10001676,Hon 61000 Series Interactive Training Tables,FURNITURE,Tables
FUR-TA-10001691,"Barricks Non-Folding Utility Table with Steel Legs, Laminate Tops",FURNITURE,Tables
FUR-TA-10001693,"Bevis Training Table, with Bottom Storage",FURNITURE,Tables
FUR-TA-10001705,Bush Advantage Collection Round Conference Table,FURNITURE,Tables
FUR-TA-10001768,Hon Racetrack Conference Tables,FURNITURE,Tables
FUR-TA-10001771,"Bush Cubix Conference Tables, Fully Assembled",FURNITURE,Tables
FUR-TA-10001786,"Chromcraft Computer Table, with Bottom Storage",FURNITURE,Tables
FUR-TA-10001857,Balt Solid Wood Rectangular Table,FURNITURE,Tables
FUR-TA-10001866,Bevis Round Conference Room Tables and Bases,FURNITURE,Tables
FUR-TA-10001889,Bush Advantage Collection Racetrack Conference Table,FURNITURE,Tables
FUR-TA-10001930,"Bevis Computer Table, with Bottom Storage",FURNITURE,Tables
FUR-TA-10001932,"Chromcraft 48"" x 96"" Racetrack Double Pedestal Table",FURNITURE,Tables
FUR-TA-10001950,Balt Solid Wood Round Tables,FURNITURE,Tables
FUR-TA-10002041,"Bevis Round Conference Table Top, X-Base",FURNITURE,Tables
FUR-TA-10002146,"Hon Coffee Table, with Bottom Storage",FURNITURE,Tables
FUR-TA-10002153,"Lesro Round Table, with Bottom Storage",FURNITURE,Tables
FUR-TA-10002228,"Bevis Traditional Conference Table Top, Plinth Base",FURNITURE,Tables
FUR-TA-10002356,Bevis Boat-Shaped Conference Table,FURNITURE,Tables
FUR-TA-10002467,"Lesro Conference Table, Adjustable Height",FURNITURE,Tables
FUR-TA-10002530,"Iceberg OfficeWorks 42"" Round Tables",FURNITURE,Tables
FUR-TA-10002533,BPI Conference Tables,FURNITURE,Tables
FUR-TA-10002568,"Chromcraft Coffee Table, Rectangular",FURNITURE,Tables
FUR-TA-10002607,KI Conference Tables,FURNITURE,Tables
FUR-TA-10002622,"Bush Andora Conference Table, Maple/Graphite Gray Finish",FURNITURE,Tables
FUR-TA-10002645,Hon Rectangular Conference Tables,FURNITURE,Tables
FUR-TA-10002699,"Hon Round Table, Rectangular",FURNITURE,Tables
FUR-TA-10002774,Laminate Occasional Tables,FURNITURE,Tables
FUR-TA-10002827,"Hon Computer Table, Fully Assembled",FURNITURE,Tables
FUR-TA-10002833,"Lesro Training Table, Rectangular",FURNITURE,Tables
FUR-TA-10002855,Bevis Round Conference Table Top & Single Column Base,FURNITURE,Tables
FUR-TA-10002860,"Hon Training Table, with Bottom Storage",FURNITURE,Tables
FUR-TA-10002903,"Bevis Round Bullnose 29"" High Table Top",FURNITURE,Tables
FUR-TA-10002958,"Bevis Oval Conference Table, Walnut",FURNITURE,Tables
FUR-TA-10003008,"Lesro Round Back Collection Coffee Table, End Table",FURNITURE,Tables
FUR-TA-10003179,"Lesro Wood Table, Fully Assembled",FURNITURE,Tables
FUR-TA-10003222,"Barricks Wood Table, with Bottom Storage",FURNITURE,Tables
FUR-TA-10003238,"Chromcraft Bull-Nose Wood 48"" x 96"" Rectangular Conference Tables",FURNITURE,Tables
FUR-TA-10003319,"Barricks Coffee Table, with Bottom Storage",FURNITURE,Tables
FUR-TA-10003371,"Chromcraft Training Table, Adjustable Height",FURNITURE,Tables
FUR-TA-10003392,Global Adaptabilities Conference Tables,FURNITURE,Tables
FUR-TA-10003469,Balt Split Level Computer Training Table,FURNITURE,Tables
FUR-TA-10003473,Bretford Rectangular Conference Table Tops,FURNITURE,Tables
FUR-TA-10003527,"Chromcraft Wood Table, with Bottom Storage",FURNITURE,Tables
FUR-TA-10003569,Bretford CR8500 Series Meeting Room Furniture,FURNITURE,Tables
FUR-TA-10003583,"Lesro Computer Table, with Bottom Storage",FURNITURE,Tables
FUR-TA-10003715,Hon 2111 Invitation Series Corner Table,FURNITURE,Tables
FUR-TA-10003748,Bevis 36 x 72 Conference Tables,FURNITURE,Tables
FUR-TA-10003785,"Hon Round Table, Adjustable Height",FURNITURE,Tables
FUR-TA-10003837,Anderson Hickey Conga Table Tops & Accessories,FURNITURE,Tables
FUR-TA-10003893,"Lesro Wood Table, with Bottom Storage",FURNITURE,Tables
FUR-TA-10003954,Hon 94000 Series Round Tables,FURNITURE,Tables
FUR-TA-10004132,"Bevis Coffee Table, with Bottom Storage",FURNITURE,Tables
FUR-TA-10004147,Hon 4060 Series Tables,FURNITURE,Tables
FUR-TA-10004152,"Barricks 18"" x 48"" Non-Folding Utility Table with Bottom Storage Shelf",FURNITURE,Tables
FUR-TA-10004154,"Riverside Furniture Oval Coffee Table, Oval End Table, End Table with Drawer",FURNITURE,Tables
FUR-TA-10004175,"Hon 30"" x 60"" Table with Locking Drawer",FURNITURE,Tables
FUR-TA-10004256,Bretford “Just In Time” Height-Adjustable Multi-Task Work Tables,FURNITURE,Tables
FUR-TA-10004289,BoxOffice By Design Rectangular and Half-Moon Meeting Room Tables,FURNITURE,Tables
FUR-TA-10004442,Riverside Furniture Stanwyck Manor Table Series,FURNITURE,Tables
FUR-TA-10004534,Bevis 44 x 96 Conference Tables,FURNITURE,Tables
FUR-TA-10004575,Hon 5100 Series Wood Tables,FURNITURE,Tables
FUR-TA-10004607,Hon 2111 Invitation Series Straight Table,FURNITURE,Tables
FUR-TA-10004619,Hon Non-Folding Utility Tables,FURNITURE,Tables
FUR-TA-10004649,"Barricks Round Table, Rectangular",FURNITURE,Tables
FUR-TA-10004767,Safco Drafting Table,FURNITURE,Tables
FUR-TA-10004915,"Office Impressions End Table, 20-1/2""H x 24""W x 20""D",FURNITURE,Tables
OFF-ACC-10000102,"Acco Binding Machine, Clear",OFFICE SUPPLIES,Binders
OFF-ACC-10000218,"Acco Hole Reinforcements, Durable",OFFICE SUPPLIES,Binders
OFF-ACC-10000233,"Acco Binder, Economy",OFFICE SUPPLIES,Binders
OFF-ACC-10000307,"Acco Index Tab, Clear",OFFICE SUPPLIES,Binders
OFF-ACC-10000375,"Accos Staples, 12 Pack",OFFICE SUPPLIES,Fasteners
OFF-ACC-10000497,"Accos Rubber Bands, Assorted Sizes",OFFICE SUPPLIES,Fasteners
OFF-ACC-10000687,"Accos Clamps, 12 Pack",OFFICE SUPPLIES,Fasteners
OFF-ACC-10000798,"Acco Hole Reinforcements, Economy",OFFICE SUPPLIES,Binders
OFF-ACC-10000808,"Acco 3-Hole Punch, Economy",OFFICE SUPPLIES,Binders
OFF-ACC-10001028,"Accos Push Pins, Metal",OFFICE SUPPLIES,Fasteners
OFF-ACC-10001281,"Accos Clamps, Bulk Pack",OFFICE SUPPLIES,Fasteners
OFF-ACC-10001703,"Acco Binder, Recycled",OFFICE SUPPLIES,Binders
OFF-ACC-10001993,"Acco Binder Covers, Clear",OFFICE SUPPLIES,Binders
OFF-ACC-10002167,"Accos Paper Clips, Metal",OFFICE SUPPLIES,Fasteners
OFF-ACC-10002220,"Acco Binding Machine, Economy",OFFICE SUPPLIES,Binders
OFF-ACC-10002327,"Accos Thumb Tacks, Metal",OFFICE SUPPLIES,Fasteners
OFF-ACC-10002343,"Acco 3-Hole Punch, Durable",OFFICE SUPPLIES,Binders
OFF-ACC-10002425,"Accos Thumb Tacks, Assorted Sizes",OFFICE SUPPLIES,Fasteners
OFF-ACC-10002680,"Acco Binding Machine, Recycled",OFFICE SUPPLIES,Binders
OFF-ACC-10002772,"Acco Index Tab, Economy",OFFICE SUPPLIES,Binders
OFF-ACC-10002834,"Accos Thumb Tacks, 12 Pack",OFFICE SUPPLIES,Fasteners
OFF-ACC-10002849,"Acco 3-Hole Punch, Clear",OFFICE SUPPLIES,Binders
OFF-ACC-10002853,"Accos Thumb Tacks, Bulk Pack",OFFICE SUPPLIES,Fasteners
OFF-ACC-10003265,"Accos Rubber Bands, Bulk Pack",OFFICE SUPPLIES,Fasteners
OFF-ACC-10003422,"Acco Binder, Durable",OFFICE SUPPLIES,Binders
OFF-ACC-10003636,"Acco Binding Machine, Durable",OFFICE SUPPLIES,Binders
OFF-ACC-10003713,"Accos Clamps, Assorted Sizes",OFFICE SUPPLIES,Fasteners
OFF-ACC-10003745,"Accos Paper Clips, Assorted Sizes",OFFICE SUPPLIES,Fasteners
OFF-ACC-10003788,"Acco Hole Reinforcements, Clear",OFFICE SUPPLIES,Binders
OFF-ACC-10003806,"Accos Clamps, Metal",OFFICE SUPPLIES,Fasteners
OFF-ACC-10003909,"Accos Push Pins, Assorted Sizes",OFFICE SUPPLIES,Fasteners
OFF-ACC-10003925,"Accos Staples, Bulk Pack",OFFICE SUPPLIES,Fasteners
OFF-ACC-10004008,"Acco Binder Covers, Durable",OFFICE SUPPLIES,Binders
OFF-ACC-10004182,"Acco Index Tab, Durable",OFFICE SUPPLIES,Binders
OFF-ACC-10004278,"Accos Paper Clips, Bulk Pack",OFFICE SUPPLIES,Fasteners
OFF-ACC-10004281,"Acco Hole Reinforcements, Recycled",OFFICE SUPPLIES,Binders
OFF-ACC-10004322,"Acco Binder, Clear",OFFICE SUPPLIES,Binders
OFF-ACC-10004364,"Accos Push Pins, Bulk Pack",OFFICE SUPPLIES,Fasteners
OFF-ACC-10004430,"Accos Rubber Bands, 12 Pack",OFFICE SUPPLIES,Fasteners
OFF-ACC-10004538,"Acco Binder Covers, Recycled",OFFICE SUPPLIES,Binders
OFF-ACC-10004692,"Acco 3-Hole Punch, Recycled",OFFICE SUPPLIES,Binders
OFF-ACC-10004713,"Accos Staples, Assorted Sizes",OFFICE SUPPLIES,Fasteners
OFF-ACC-10004748,"Accos Push Pins, 12 Pack",OFFICE SUPPLIES,Fasteners
OFF-ACC-10004782,"Accos Staples, Metal",OFFICE SUPPLIES,Fasteners
OFF-ACC-10004871,"Acco Binder Covers, Economy",OFFICE SUPPLIES,Binders
OFF-ACC-10004910,"Accos Rubber Bands, Metal",OFFICE SUPPLIES,Fasteners
OFF-ACM-10000277,"Acme Ruler, High Speed",OFFICE SUPPLIES,Supplies
OFF-ACM-10000476,"Acme Letter Opener, Easy Grip",OFFICE SUPPLIES,Supplies
OFF-ACM-10000570,"Acme Letter Opener, High Speed",OFFICE SUPPLIES,Supplies
OFF-ACM-10000671,"Acme Ruler, Steel",OFFICE SUPPLIES,Supplies
OFF-ACM-10000777,"Acme Scissors, Serrated",OFFICE SUPPLIES,Supplies
OFF-ACM-10001029,"Acme Box Cutter, Serrated",OFFICE SUPPLIES,Supplies
OFF-ACM-10001112,"Acme Shears, Steel",OFFICE SUPPLIES,Supplies
OFF-ACM-10001587,"Acme Box Cutter, Easy Grip",OFFICE SUPPLIES,Supplies
OFF-ACM-10001704,"Acme Letter Opener, Serrated",OFFICE SUPPLIES,Supplies
OFF-ACM-10002045,"Acme Shears, High Speed",OFFICE SUPPLIES,Supplies
OFF-ACM-10002131,"Acme Ruler, Easy Grip",OFFICE SUPPLIES,Supplies
OFF-ACM-10002301,"Acme Trimmer, Serrated",OFFICE SUPPLIES,Supplies
OFF-ACM-10002713,"Acme Box Cutter, Steel",OFFICE SUPPLIES,Supplies
OFF-ACM-10002816,"Acme Letter Opener, Steel",OFFICE SUPPLIES,Supplies
OFF-ACM-10003278,"Acme Trimmer, Easy Grip",OFFICE SUPPLIES,Supplies
OFF-ACM-10003510,"Acme Scissors, High Speed",OFFICE SUPPLIES,Supplies
OFF-ACM-10003591,"Acme Trimmer, Steel",OFFICE SUPPLIES,Supplies
OFF-ACM-10003715,"Acme Shears, Serrated",OFFICE SUPPLIES,Supplies
OFF-ACM-10003978,"Acme Trimmer, High Speed",OFFICE SUPPLIES,Supplies
OFF-ACM-10004150,"Acme Ruler, Serrated",OFFICE SUPPLIES,Supplies
OFF-ACM-10004587,"Acme Scissors, Steel",OFFICE SUPPLIES,Supplies
OFF-ACM-10004669,"Acme Shears, Easy Grip",OFFICE SUPPLIES,Supplies
OFF-ACM-10004895,"Acme Scissors, Easy Grip",OFFICE SUPPLIES,Supplies
OFF-ADV-10000177,"Advantus Staples, Metal",OFFICE SUPPLIES,Fasteners
OFF-ADV-10000213,"Advantus Rubber Bands, Metal",OFFICE SUPPLIES,Fasteners
OFF-ADV-10000308,"Advantus Push Pins, 12 Pack",OFFICE SUPPLIES,Fasteners
OFF-ADV-10000331,"Advantus Paper Clips, Assorted Sizes",OFFICE SUPPLIES,Fasteners
OFF-ADV-10000425,"Advantus Clamps, Metal",OFFICE SUPPLIES,Fasteners
OFF-ADV-10000551,"Advantus Thumb Tacks, Bulk Pack",OFFICE SUPPLIES,Fasteners
OFF-ADV-10001124,"Advantus Clamps, 12 Pack",OFFICE SUPPLIES,Fasteners
OFF-ADV-10001437,"Advantus Paper Clips, Bulk Pack",OFFICE SUPPLIES,Fasteners
OFF-ADV-10001451,"Advantus Clamps, Assorted Sizes",OFFICE SUPPLIES,Fasteners
OFF-ADV-10002299,"Advantus Rubber Bands, 12 Pack",OFFICE SUPPLIES,Fasteners
OFF-ADV-10002549,"Advantus Rubber Bands, Assorted Sizes",OFFICE SUPPLIES,Fasteners
OFF-ADV-10002593,"Advantus Clamps, Bulk Pack",OFFICE SUPPLIES,Fasteners
OFF-ADV-10003030,"Advantus Staples, 12 Pack",OFFICE SUPPLIES,Fasteners
OFF-ADV-10003050,"Advantus Rubber Bands, Bulk Pack",OFFICE SUPPLIES,Fasteners
OFF-ADV-10003196,"Advantus Staples, Assorted Sizes",OFFICE SUPPLIES,Fasteners
OFF-ADV-10003369,"Advantus Thumb Tacks, Assorted Sizes",OFFICE SUPPLIES,Fasteners
OFF-ADV-10004030,"Advantus Push Pins, Metal",OFFICE SUPPLIES,Fasteners
OFF-ADV-10004228,"Advantus Push Pins, Assorted Sizes",OFFICE SUPPLIES,Fasteners
OFF-ADV-10004241,"Advantus Thumb Tacks, 12 Pack",OFFICE SUPPLIES,Fasteners
OFF-ADV-10004274,"Advantus Thumb Tacks, Metal",OFFICE SUPPLIES,Fasteners
OFF-ADV-10004598,"Advantus Paper Clips, Metal",OFFICE SUPPLIES,Fasteners
OFF-ADV-10004875,"Advantus Staples, Bulk Pack",OFFICE SUPPLIES,Fasteners
OFF-AME-10000244,"Ames Manila Envelope, Security-Tint",OFFICE SUPPLIES,Envelopes
OFF-AME-10000360,"Ames Interoffice Envelope, Security-Tint",OFFICE SUPPLIES,Envelopes
OFF-AME-10000440,"Ames Interoffice Envelope, with clear poly window",OFFICE SUPPLIES,Envelopes
OFF-AME-10000851,"Ames Mailers, with clear poly window",OFFICE SUPPLIES,Envelopes
OFF-AME-10000870,"Ames Peel and Seal, Recycled",OFFICE SUPPLIES,Envelopes
OFF-AME-10001009,"Ames Interoffice Envelope, Set of 50",OFFICE SUPPLIES,Envelopes
OFF-AME-10001179,"Ames Mailers, Set of 50",OFFICE SUPPLIES,Envelopes
OFF-AME-10001489,"Ames Manila Envelope, Set of 50",OFFICE SUPPLIES,Envelopes
OFF-AME-10001587,"Ames Peel and Seal, with clear poly window",OFFICE SUPPLIES,Envelopes
OFF-AME-10001641,"Ames Interoffice Envelope, Recycled",OFFICE SUPPLIES,Envelopes
OFF-AME-10002081,"Ames Peel and Seal, Security-Tint",OFFICE SUPPLIES,Envelopes
OFF-AME-10002376,"Ames Manila Envelope, Recycled",OFFICE SUPPLIES,Envelopes
OFF-AME-10002557,"Ames Business Envelopes, Recycled",OFFICE SUPPLIES,Envelopes
OFF-AME-10002652,"Ames Peel and Seal, Set of 50",OFFICE SUPPLIES,Envelopes
OFF-AME-10002923,"Ames Clasp Envelope, Set of 50",OFFICE SUPPLIES,Envelopes
OFF-AME-10002949,"Ames Clasp Envelope, with clear poly window",OFFICE SUPPLIES,Envelopes
OFF-AME-10002956,"Ames Business Envelopes, Security-Tint",OFFICE SUPPLIES,Envelopes
OFF-AME-10003089,"Ames Clasp Envelope, Security-Tint",OFFICE SUPPLIES,Envelopes
OFF-AME-10003167,"Ames Clasp Envelope, Recycled",OFFICE SUPPLIES,Envelopes
OFF-AME-10003180,"Ames Business Envelopes, Set of 50",OFFICE SUPPLIES,Envelopes
OFF-AME-10004651,"Ames Mailers, Recycled",OFFICE SUPPLIES,Envelopes
OFF-AME-10004759,"Ames Manila Envelope, with clear poly window",OFFICE SUPPLIES,Envelopes
OFF-AP-10000003,"KitchenAid Refrigerator, White",OFFICE SUPPLIES,Appliances
OFF-AP-10000004,"Cuisinart Stove, Silver",OFFICE SUPPLIES,Appliances
OFF-AP-10000005,"KitchenAid Microwave, Red",OFFICE SUPPLIES,Appliances
OFF-AP-10000023,"Breville Toaster, Black",OFFICE SUPPLIES,Appliances
OFF-AP-10000026,Tripp Lite Isotel 6 Outlet Surge Protector with Fax/Modem Protection,OFFICE SUPPLIES,Appliances
OFF-AP-10000027,Hoover Commercial SteamVac,OFFICE SUPPLIES,Appliances
OFF-AP-10000039,"Breville Coffee Grinder, Silver",OFFICE SUPPLIES,Appliances
OFF-AP-10000043,"Cuisinart Toaster, Silver",OFFICE SUPPLIES,Appliances
OFF-AP-10000055,Belkin F9S820V06 8 Outlet Surge,OFFICE SUPPLIES,Appliances
OFF-AP-10000078,"Breville Toaster, Silver",OFFICE SUPPLIES,Appliances
OFF-AP-10000108,"Breville Refrigerator, Black",OFFICE SUPPLIES,Appliances
OFF-AP-10000119,"Breville Microwave, White",OFFICE SUPPLIES,Appliances
OFF-AP-10000124,Acco 6 Outlet Guardian Basic Surge Suppressor,OFFICE SUPPLIES,Appliances
OFF-AP-10000136,"Hamilton Beach Refrigerator, White",OFFICE SUPPLIES,Appliances
OFF-AP-10000159,Belkin F9M820V08 8 Outlet Surge,OFFICE SUPPLIES,Appliances
OFF-AP-10000162,"Breville Microwave, Black",OFFICE SUPPLIES,Appliances
OFF-AP-10000179,"Breville Refrigerator, Red",OFFICE SUPPLIES,Appliances
OFF-AP-10000179,Honeywell Enviracaire Portable HEPA Air Cleaner for up to 10 x 16 Room,OFFICE SUPPLIES,Appliances
OFF-AP-10000195,"Cuisinart Stove, Black",OFFICE SUPPLIES,Appliances
OFF-AP-10000200,"KitchenAid Refrigerator, Red",OFFICE SUPPLIES,Appliances
OFF-AP-10000213,"Cuisinart Refrigerator, Black",OFFICE SUPPLIES,Appliances
OFF-AP-10000226,"Hoover Coffee Grinder, Black",OFFICE SUPPLIES,Appliances
OFF-AP-10000228,"Cuisinart Blender, White",OFFICE SUPPLIES,Appliances
OFF-AP-10000240,Belkin F9G930V10-GRY 9 Outlet Surge,OFFICE SUPPLIES,Appliances
OFF-AP-10000252,Harmony HEPA Quiet Air Purifiers,OFFICE SUPPLIES,Appliances
OFF-AP-10000258,"Hamilton Beach Blender, Black",OFFICE SUPPLIES,Appliances
OFF-AP-10000263,"KitchenAid Microwave, Silver",OFFICE SUPPLIES,Appliances
OFF-AP-10000275,"Sanyo Counter Height Refrigerator with Crisper, 3.6 Cubic Foot, Stainless Steel/Black",OFFICE SUPPLIES,Appliances
OFF-AP-10000285,"Breville Microwave, Silver",OFFICE SUPPLIES,Appliances
OFF-AP-10000304,"Hoover Microwave, White",OFFICE SUPPLIES,Appliances
OFF-AP-10000304,"Breville Stove, Red",OFFICE SUPPLIES,Appliances
OFF-AP-10000326,Belkin 7 Outlet SurgeMaster Surge Protector with Phone Protection,OFFICE SUPPLIES,Appliances
OFF-AP-10000330,"Hamilton Beach Stove, Red",OFFICE SUPPLIES,Appliances
OFF-AP-10000335,"Cuisinart Microwave, Red",OFFICE SUPPLIES,Appliances
OFF-AP-10000344,"Hoover Toaster, Silver",OFFICE SUPPLIES,Appliances
OFF-AP-10000358,Fellowes Basic Home/Office Series Surge Protectors,OFFICE SUPPLIES,Appliances
OFF-AP-10000381,"Hoover Refrigerator, Red",OFFICE SUPPLIES,Appliances
OFF-AP-10000382,"Breville Coffee Grinder, White",OFFICE SUPPLIES,Appliances
OFF-AP-10000390,Euro Pro Shark Stick Mini Vacuum,OFFICE SUPPLIES,Appliances
OFF-AP-10000391,"Hamilton Beach Coffee Grinder, Black",OFFICE SUPPLIES,Appliances
OFF-AP-10000407,"KitchenAid Refrigerator, Silver",OFFICE SUPPLIES,Appliances
OFF-AP-10000415,"KitchenAid Toaster, Red",OFFICE SUPPLIES,Appliances
OFF-AP-10000487,"Hoover Stove, Silver",OFFICE SUPPLIES,Appliances
OFF-AP-10000490,"Hamilton Beach Coffee Grinder, Silver",OFFICE SUPPLIES,Appliances
OFF-AP-10000509,"Hoover Refrigerator, Black",OFFICE SUPPLIES,Appliances
OFF-AP-10000510,"Cuisinart Coffee Grinder, Red",OFFICE SUPPLIES,Appliances
OFF-AP-10000528,"Breville Blender, Black",OFFICE SUPPLIES,Appliances
OFF-AP-10000534,"KitchenAid Toaster, Silver",OFFICE SUPPLIES,Appliances
OFF-AP-10000540,"Hamilton Beach Refrigerator, Red",OFFICE SUPPLIES,Appliances
OFF-AP-10000545,"Cuisinart Toaster, Black",OFFICE SUPPLIES,Appliances
OFF-AP-10000569,"KitchenAid Coffee Grinder, Black",OFFICE SUPPLIES,Appliances
OFF-AP-10000576,"Belkin 325VA UPS Surge Protector, 6'",OFFICE SUPPLIES,Appliances
OFF-AP-10000576,Belkin 7 Outlet SurgeMaster II,OFFICE SUPPLIES,Appliances
OFF-AP-10000584,"Breville Refrigerator, Silver",OFFICE SUPPLIES,Appliances
OFF-AP-10000595,Disposable Triple-Filter Dust Bags,OFFICE SUPPLIES,Appliances
OFF-AP-10000600,"KitchenAid Coffee Grinder, Silver",OFFICE SUPPLIES,Appliances
OFF-AP-10000639,"Breville Microwave, Red",OFFICE SUPPLIES,Appliances
OFF-AP-10000647,"Hoover Refrigerator, White",OFFICE SUPPLIES,Appliances
OFF-AP-10000663,"Hoover Stove, Red",OFFICE SUPPLIES,Appliances
OFF-AP-10000667,"Breville Stove, White",OFFICE SUPPLIES,Appliances
OFF-AP-10000672,"KitchenAid Stove, White",OFFICE SUPPLIES,Appliances
OFF-AP-10000675,"Hamilton Beach Stove, White",OFFICE SUPPLIES,Appliances
OFF-AP-10000691,"Cuisinart Refrigerator, Red",OFFICE SUPPLIES,Appliances
OFF-AP-10000692,Fellowes Mighty 8 Compact Surge Protector,OFFICE SUPPLIES,Appliances
OFF-AP-10000696,Holmes Odor Grabber,OFFICE SUPPLIES,Appliances
OFF-AP-10000717,"Hoover Microwave, Black",OFFICE SUPPLIES,Appliances
OFF-AP-10000775,"Breville Blender, Silver",OFFICE SUPPLIES,Appliances
OFF-AP-10000804,Hoover Portapower Portable Vacuum,OFFICE SUPPLIES,Appliances
OFF-AP-10000818,"Hoover Blender, Black",OFFICE SUPPLIES,Appliances
OFF-AP-10000825,"KitchenAid Coffee Grinder, White",OFFICE SUPPLIES,Appliances
OFF-AP-10000828,Avanti 4.4 Cu. Ft. Refrigerator,OFFICE SUPPLIES,Appliances
OFF-AP-10000864,"Hamilton Beach Refrigerator, Black",OFFICE SUPPLIES,Appliances
