PRODUCT_ID,PRODUCT_NAME,CATEGORY,SUB_CATEGORY
OFF-BI-10003694,"Avery 3 1/2"" Diskette Storage Pages, 10/Pack",OFFICE SUPPLIES,Binders
OFF-BI-10003707,Aluminum Screw Posts,OFFICE SUPPLIES,Binders
OFF-BI-10003708,"Acco Four Pocket Poly Ring Binder with Label Holder, Smoke, 1""",OFFICE SUPPLIES,Binders
OFF-BI-10003712,"Acco Pressboard Covers with Storage Hooks, 14 7/8"" x 11"", Light Blue",OFFICE SUPPLIES,Binders
OFF-BI-10003718,GBC Therma-A-Bind 250T Electric Binding System,OFFICE SUPPLIES,Binders
OFF-BI-10003719,Large Capacity Hanging Post Binders,OFFICE SUPPLIES,Binders
OFF-BI-10003727,Avery Durable Slant Ring Binders With Label Holder,OFFICE SUPPLIES,Binders
OFF-BI-10003784,Computer Printout Index Tabs,OFFICE SUPPLIES,Binders
OFF-BI-10003876,"Green Canvas Binder for 8-1/2"" x 14"" Sheets",OFFICE SUPPLIES,Binders
OFF-BI-10003910,DXL Angle-View Binders with Locking Rings by Samsill,OFFICE SUPPLIES,Binders
OFF-BI-10003925,Fellowes PB300 Plastic Comb Binding Machine,OFFICE SUPPLIES,Binders
OFF-BI-10003963,Cardinal Holdit Data Disk Pockets,OFFICE SUPPLIES,Binders
OFF-BI-10003981,"Avery Durable Plastic 1"" Binders",OFFICE SUPPLIES,Binders
OFF-BI-10003982,Wilson Jones Century Plastic Molded Ring Binders,OFFICE SUPPLIES,Binders
OFF-BI-10003984,Lock-Up Easel 'Spel-Binder',OFFICE SUPPLIES,Binders
OFF-BI-10004001,GBC Recycled VeloBinder Covers,OFFICE SUPPLIES,Binders
OFF-BI-10004002,Wilson Jones International Size A4 Ring Binders,OFFICE SUPPLIES,Binders
OFF-BI-10004022,Acco Suede Grain Vinyl Round Ring Binder,OFFICE SUPPLIES,Binders
OFF-BI-10004040,Wilson Jones Impact Binders,OFFICE SUPPLIES,Binders
OFF-BI-10004094,GBC Standard Plastic Binding Systems Combs,OFFICE SUPPLIES,Binders
OFF-BI-10004099,GBC VeloBinder Strips,OFFICE SUPPLIES,Binders
OFF-BI-10004139,Fellowes Presentation Covers for Comb Binding Machines,OFFICE SUPPLIES,Binders
OFF-BI-10004141,Insertable Tab Indexes For Data Binders,OFFICE SUPPLIES,Binders
OFF-BI-10004182,Economy Binders,OFFICE SUPPLIES,Binders
OFF-BI-10004209,"Fellowes Twister Kit, Gray/Clear, 3/pkg",OFFICE SUPPLIES,Binders
OFF-BI-10004224,Catalog Binders with Expanding Posts,OFFICE SUPPLIES,Binders
OFF-BI-10004230,GBC Recycled Grain Textured Covers,OFFICE SUPPLIES,Binders
OFF-BI-10004233,"GBC Pre-Punched Binding Paper, Plastic, White, 8-1/2"" x 11""",OFFICE SUPPLIES,Binders
OFF-BI-10004236,"XtraLife ClearVue Slant-D Ring Binder, White, 3""",OFFICE SUPPLIES,Binders
OFF-BI-10004308,Avery Legal 4-Ring Binder,OFFICE SUPPLIES,Binders
OFF-BI-10004318,Ibico EB-19 Dual Function Manual Binding System,OFFICE SUPPLIES,Binders
OFF-BI-10004330,"GBC Velobind Prepunched Cover Sets, Regency Series",OFFICE SUPPLIES,Binders
OFF-BI-10004352,Wilson Jones DublLock D-Ring Binders,OFFICE SUPPLIES,Binders
OFF-BI-10004390,GBC DocuBind 200 Manual Binding Machine,OFFICE SUPPLIES,Binders
OFF-BI-10004410,"C-Line Peel & Stick Add-On Filing Pockets, 8-3/4 x 5-1/8, 10/Pack",OFFICE SUPPLIES,Binders
OFF-BI-10004465,Avery Durable Slant Ring Binders,OFFICE SUPPLIES,Binders
OFF-BI-10004492,Tuf-Vin Binders,OFFICE SUPPLIES,Binders
OFF-BI-10004506,Wilson Jones data.warehouse D-Ring Binders with DublLock,OFFICE SUPPLIES,Binders
OFF-BI-10004519,GBC DocuBind P100 Manual Binding Machine,OFFICE SUPPLIES,Binders
OFF-BI-10004528,Cardinal Poly Pocket Divider Pockets for Ring Binders,OFFICE SUPPLIES,Binders
OFF-BI-10004584,GBC ProClick 150 Presentation Binding System,OFFICE SUPPLIES,Binders
OFF-BI-10004593,Ibico Laser Imprintable Binding System Covers,OFFICE SUPPLIES,Binders
OFF-BI-10004600,Ibico Ibimaster 300 Manual Binding System,OFFICE SUPPLIES,Binders
OFF-BI-10004632,Ibico Hi-Tech Manual Binding System,OFFICE SUPPLIES,Binders
OFF-BI-10004632,GBC Binding covers,OFFICE SUPPLIES,Binders
OFF-BI-10004654,Avery Binding System Hidden Tab Executive Style Index Sets,OFFICE SUPPLIES,Binders
OFF-BI-10004654,VariCap6 Expandable Binder,OFFICE SUPPLIES,Binders
OFF-BI-10004656,Peel & Stick Add-On Corner Pockets,OFFICE SUPPLIES,Binders
OFF-BI-10004716,Wilson Jones Hanging Recycled Pressboard Data Binders,OFFICE SUPPLIES,Binders
OFF-BI-10004728,Wilson Jones Turn Tabs Binder Tool for Ring Binders,OFFICE SUPPLIES,Binders
OFF-BI-10004738,Flexible Leather- Look Classic Collection Ring Binder,OFFICE SUPPLIES,Binders
OFF-BI-10004781,GBC Wire Binding Strips,OFFICE SUPPLIES,Binders
OFF-BI-10004817,GBC Personal VeloBind Strips,OFFICE SUPPLIES,Binders
OFF-BI-10004826,JM Magazine Binder,OFFICE SUPPLIES,Binders
OFF-BI-10004828,GBC Poly Designer Binding Covers,OFFICE SUPPLIES,Binders
OFF-BI-10004876,Wilson Jones Suede Grain Vinyl Binders,OFFICE SUPPLIES,Binders
OFF-BI-10004965,Ibico Covers for Plastic or Wire Binding Elements,OFFICE SUPPLIES,Binders
OFF-BI-10004967,Round Ring Binders,OFFICE SUPPLIES,Binders
OFF-BI-10004970,"ACCOHIDE 3-Ring Binder, Blue, 1""",OFFICE SUPPLIES,Binders
OFF-BI-10004995,GBC DocuBind P400 Electric Binding System,OFFICE SUPPLIES,Binders
OFF-CAM-10000192,"Cameo Interoffice Envelope, with clear poly window",OFFICE SUPPLIES,Envelopes
OFF-CAM-10000497,"Cameo Manila Envelope, Set of 50",OFFICE SUPPLIES,Envelopes
OFF-CAM-10000726,"Cameo Interoffice Envelope, Security-Tint",OFFICE SUPPLIES,Envelopes
OFF-CAM-10001141,"Cameo Manila Envelope, Security-Tint",OFFICE SUPPLIES,Envelopes
OFF-CAM-10001177,"Cameo Manila Envelope, Recycled",OFFICE SUPPLIES,Envelopes
OFF-CAM-10001191,"Cameo Peel and Seal, Recycled",OFFICE SUPPLIES,Envelopes
OFF-CAM-10001249,"Cameo Mailers, with clear poly window",OFFICE SUPPLIES,Envelopes
OFF-CAM-10001341,"Cameo Business Envelopes, Recycled",OFFICE SUPPLIES,Envelopes
OFF-CAM-10001690,"Cameo Clasp Envelope, Recycled",OFFICE SUPPLIES,Envelopes
OFF-CAM-10001761,"Cameo Clasp Envelope, Security-Tint",OFFICE SUPPLIES,Envelopes
OFF-CAM-10002159,"Cameo Manila Envelope, with clear poly window",OFFICE SUPPLIES,Envelopes
OFF-CAM-10002611,"Cameo Interoffice Envelope, Recycled",OFFICE SUPPLIES,Envelopes
OFF-CAM-10002625,"Cameo Peel and Seal, with clear poly window",OFFICE SUPPLIES,Envelopes
OFF-CAM-10002734,"Cameo Clasp Envelope, with clear poly window",OFFICE SUPPLIES,Envelopes
OFF-CAM-10003488,"Cameo Mailers, Set of 50",OFFICE SUPPLIES,Envelopes
OFF-CAM-10003511,"Cameo Clasp Envelope, Set of 50",OFFICE SUPPLIES,Envelopes
OFF-CAM-10003605,"Cameo Peel and Seal, Security-Tint",OFFICE SUPPLIES,Envelopes
OFF-CAM-10004002,"Cameo Business Envelopes, Set of 50",OFFICE SUPPLIES,Envelopes
OFF-CAM-10004269,"Cameo Business Envelopes, Security-Tint",OFFICE SUPPLIES,Envelopes
OFF-CAM-10004271,"Cameo Mailers, Recycled",OFFICE SUPPLIES,Envelopes
OFF-CAM-10004338,"Cameo Interoffice Envelope, Set of 50",OFFICE SUPPLIES,Envelopes
OFF-CAM-10004790,"Cameo Peel and Seal, Set of 50",OFFICE SUPPLIES,Envelopes
OFF-EAT-10000522,"Eaton Computer Printout Paper, Multicolor",OFFICE SUPPLIES,Paper
OFF-EAT-10000652,"Eaton Computer Printout Paper, 8.5 x 11",OFFICE SUPPLIES,Paper
OFF-EAT-10000820,"Eaton Message Books, Multicolor",OFFICE SUPPLIES,Paper
OFF-EAT-10000854,"Eaton Parchment Paper, Recycled",OFFICE SUPPLIES,Paper
OFF-EAT-10001025,"Eaton Note Cards, Multicolor",OFFICE SUPPLIES,Paper
OFF-EAT-10001137,"Eaton Parchment Paper, 8.5 x 11",OFFICE SUPPLIES,Paper
OFF-EAT-10001303,"Eaton Message Books, Premium",OFFICE SUPPLIES,Paper
OFF-EAT-10001933,"Eaton Cards & Envelopes, Recycled",OFFICE SUPPLIES,Paper
OFF-EAT-10002068,"Eaton Note Cards, Premium",OFFICE SUPPLIES,Paper
OFF-EAT-10002122,"Eaton Cards & Envelopes, 8.5 x 11",OFFICE SUPPLIES,Paper
OFF-EAT-10002122,"Eaton Cards & Envelopes, Premium",OFFICE SUPPLIES,Paper
OFF-EAT-10002463,"Eaton Computer Printout Paper, Premium",OFFICE SUPPLIES,Paper
OFF-EAT-10002674,"Eaton Memo Slips, Multicolor",OFFICE SUPPLIES,Paper
OFF-EAT-10002789,"Eaton Computer Printout Paper, Recycled",OFFICE SUPPLIES,Paper
OFF-EAT-10003094,"Eaton Memo Slips, Premium",OFFICE SUPPLIES,Paper
OFF-EAT-10003338,"Eaton Message Books, 8.5 x 11",OFFICE SUPPLIES,Paper
OFF-EAT-10003405,"Eaton Parchment Paper, Multicolor",OFFICE SUPPLIES,Paper
OFF-EAT-10004036,"Eaton Parchment Paper, Premium",OFFICE SUPPLIES,Paper
OFF-EAT-10004051,"Eaton Memo Slips, Recycled",OFFICE SUPPLIES,Paper
OFF-EAT-10004307,"Eaton Memo Slips, 8.5 x 11",OFFICE SUPPLIES,Paper
OFF-EAT-10004696,"Eaton Note Cards, 8.5 x 11",OFFICE SUPPLIES,Paper
OFF-EAT-10004908,"Eaton Message Books, Recycled",OFFICE SUPPLIES,Paper
OFF-EAT-10004979,"Eaton Cards & Envelopes, Multicolor",OFFICE SUPPLIES,Paper
OFF-ELD-10000024,"Eldon Folders, Blue",OFFICE SUPPLIES,Storage
OFF-ELD-10000124,"Eldon Trays, Single Width",OFFICE SUPPLIES,Storage
OFF-ELD-10000151,"Eldon File Cart, Industrial",OFFICE SUPPLIES,Storage
OFF-ELD-10000819,"Eldon Trays, Industrial",OFFICE SUPPLIES,Storage
OFF-ELD-10000845,"Eldon Lockers, Wire Frame",OFFICE SUPPLIES,Storage
OFF-ELD-10000967,"Eldon Folders, Industrial",OFFICE SUPPLIES,Storage
OFF-ELD-10001037,"Eldon Trays, Wire Frame",OFFICE SUPPLIES,Storage
OFF-ELD-10001293,"Eldon Box, Wire Frame",OFFICE SUPPLIES,Storage
OFF-ELD-10001318,"Eldon Lockers, Industrial",OFFICE SUPPLIES,Storage
OFF-ELD-10001477,"Eldon Lockers, Single Width",OFFICE SUPPLIES,Storage
OFF-ELD-10001694,"Eldon File Cart, Single Width",OFFICE SUPPLIES,Storage
OFF-ELD-10001832,"Eldon Shelving, Single Width",OFFICE SUPPLIES,Storage
OFF-ELD-10001882,"Eldon Box, Blue",OFFICE SUPPLIES,Storage
OFF-ELD-10002207,"Eldon Folders, Single Width",OFFICE SUPPLIES,Storage
OFF-ELD-10002240,"Eldon Shelving, Wire Frame",OFFICE SUPPLIES,Storage
OFF-ELD-10002279,"Eldon Shelving, Industrial",OFFICE SUPPLIES,Storage
OFF-ELD-10002297,"Eldon Lockers, Blue",OFFICE SUPPLIES,Storage
OFF-ELD-10002578,"Eldon Box, Single Width",OFFICE SUPPLIES,Storage
OFF-ELD-10003038,"Eldon Shelving, Blue",OFFICE SUPPLIES,Storage
OFF-ELD-10003181,"Eldon Box, Industrial",OFFICE SUPPLIES,Storage
OFF-ELD-10003918,"Eldon Folders, Wire Frame",OFFICE SUPPLIES,Storage
OFF-ELD-10004324,"Eldon File Cart, Blue",OFFICE SUPPLIES,Storage
OFF-ELD-10004625,"Eldon Trays, Blue",OFFICE SUPPLIES,Storage
OFF-ELI-10000044,"Elite Ruler, Serrated",OFFICE SUPPLIES,Supplies
OFF-ELI-10000443,"Elite Shears, Steel",OFFICE SUPPLIES,Supplies
OFF-ELI-10000541,"Elite Trimmer, High Speed",OFFICE SUPPLIES,Supplies
OFF-ELI-10000711,"Elite Scissors, Serrated",OFFICE SUPPLIES,Supplies
OFF-ELI-10000797,"Elite Ruler, High Speed",OFFICE SUPPLIES,Supplies
OFF-ELI-10001057,"Elite Trimmer, Serrated",OFFICE SUPPLIES,Supplies
OFF-ELI-10001176,"Elite Box Cutter, Easy Grip",OFFICE SUPPLIES,Supplies
OFF-ELI-10001351,"Elite Trimmer, Easy Grip",OFFICE SUPPLIES,Supplies
OFF-ELI-10001507,"Elite Scissors, Steel",OFFICE SUPPLIES,Supplies
OFF-ELI-10001685,"Elite Ruler, Steel",OFFICE SUPPLIES,Supplies
OFF-ELI-10001705,"Elite Trimmer, Steel",OFFICE SUPPLIES,Supplies
OFF-ELI-10001812,"Elite Shears, Easy Grip",OFFICE SUPPLIES,Supplies
OFF-ELI-10001904,"Elite Letter Opener, Steel",OFFICE SUPPLIES,Supplies
OFF-ELI-10002160,"Elite Scissors, Easy Grip",OFFICE SUPPLIES,Supplies
OFF-ELI-10002337,"Elite Box Cutter, High Speed",OFFICE SUPPLIES,Supplies
OFF-ELI-10002935,"Elite Shears, High Speed",OFFICE SUPPLIES,Supplies
OFF-ELI-10003004,"Elite Ruler, Easy Grip",OFFICE SUPPLIES,Supplies
OFF-ELI-10003179,"Elite Scissors, High Speed",OFFICE SUPPLIES,Supplies
OFF-ELI-10003277,"Elite Letter Opener, High Speed",OFFICE SUPPLIES,Supplies
OFF-ELI-10003732,"Elite Letter Opener, Easy Grip",OFFICE SUPPLIES,Supplies
OFF-ELI-10003911,"Elite Shears, Serrated",OFFICE SUPPLIES,Supplies
OFF-ELI-10004427,"Elite Box Cutter, Serrated",OFFICE SUPPLIES,Supplies
OFF-ELI-10004597,"Elite Box Cutter, Steel",OFFICE SUPPLIES,Supplies
OFF-EN-10000051,"GlobeWeis Manila Envelope, with clear poly window",OFFICE SUPPLIES,Envelopes
OFF-EN-10000056,Cameo Buff Policy Envelopes,OFFICE SUPPLIES,Envelopes
OFF-EN-10000061,"Jiffy Clasp Envelope, Security-Tint",OFFICE SUPPLIES,Envelopes
OFF-EN-10000069,"Ames Mailers, Security-Tint",OFFICE SUPPLIES,Envelopes
OFF-EN-10000075,"GlobeWeis Interoffice Envelope, Security-Tint",OFFICE SUPPLIES,Envelopes
OFF-EN-10000084,"Jiffy Manila Envelope, with clear poly window",OFFICE SUPPLIES,Envelopes
OFF-EN-10000094,"Jiffy Interoffice Envelope, Security-Tint",OFFICE SUPPLIES,Envelopes
OFF-EN-10000096,"Jiffy Clasp Envelope, with clear poly window",OFFICE SUPPLIES,Envelopes
OFF-EN-10000114,"Kraft Clasp Envelope, Security-Tint",OFFICE SUPPLIES,Envelopes
OFF-EN-10000128,"GlobeWeis Interoffice Envelope, Set of 50",OFFICE SUPPLIES,Envelopes
OFF-EN-10000139,"Kraft Interoffice Envelope, Set of 50",OFFICE SUPPLIES,Envelopes
OFF-EN-10000182,"Jiffy Peel and Seal, Security-Tint",OFFICE SUPPLIES,Envelopes
OFF-EN-10000219,"Jiffy Clasp Envelope, Recycled",OFFICE SUPPLIES,Envelopes
OFF-EN-10000232,"Kraft Peel and Seal, Recycled",OFFICE SUPPLIES,Envelopes
OFF-EN-10000258,"GlobeWeis Peel and Seal, with clear poly window",OFFICE SUPPLIES,Envelopes
OFF-EN-10000271,"Kraft Peel and Seal, with clear poly window",OFFICE SUPPLIES,Envelopes
OFF-EN-10000274,"Kraft Business Envelopes, Recycled",OFFICE SUPPLIES,Envelopes
OFF-EN-10000315,"Jiffy Business Envelopes, Security-Tint",OFFICE SUPPLIES,Envelopes
OFF-EN-10000315,"Kraft Manila Envelope, Recycled",OFFICE SUPPLIES,Envelopes
OFF-EN-10000328,"Kraft Business Envelopes, Set of 50",OFFICE SUPPLIES,Envelopes
OFF-EN-10000338,"Kraft Mailers, Recycled",OFFICE SUPPLIES,Envelopes
OFF-EN-10000352,"GlobeWeis Peel and Seal, Recycled",OFFICE SUPPLIES,Envelopes
OFF-EN-10000353,"Jiffy Mailers, with clear poly window",OFFICE SUPPLIES,Envelopes
OFF-EN-10000378,"Jiffy Mailers, Set of 50",OFFICE SUPPLIES,Envelopes
OFF-EN-10000387,"Kraft Clasp Envelope, Recycled",OFFICE SUPPLIES,Envelopes
OFF-EN-10000454,"GlobeWeis Business Envelopes, Set of 50",OFFICE SUPPLIES,Envelopes
OFF-EN-10000461,"#10- 4 1/8"" x 9 1/2"" Recycled Envelopes",OFFICE SUPPLIES,Envelopes
OFF-EN-10000483,"White Envelopes, White Envelopes with Clear Poly Window",OFFICE SUPPLIES,Envelopes
OFF-EN-10000507,"GlobeWeis Peel and Seal, Set of 50",OFFICE SUPPLIES,Envelopes
OFF-EN-10000556,"Kraft Interoffice Envelope, Security-Tint",OFFICE SUPPLIES,Envelopes
OFF-EN-10000606,"Jiffy Peel and Seal, Set of 50",OFFICE SUPPLIES,Envelopes
OFF-EN-10000615,"Jiffy Mailers, Security-Tint",OFFICE SUPPLIES,Envelopes
OFF-EN-10000648,"Jiffy Peel and Seal, with clear poly window",OFFICE SUPPLIES,Envelopes
OFF-EN-10000694,"GlobeWeis Business Envelopes, Security-Tint",OFFICE SUPPLIES,Envelopes
OFF-EN-10000726,"Jiffy Clasp Envelope, Set of 50",OFFICE SUPPLIES,Envelopes
OFF-EN-10000788,"Jiffy Manila Envelope, Security-Tint",OFFICE SUPPLIES,Envelopes
OFF-EN-10000812,"GlobeWeis Clasp Envelope, Set of 50",OFFICE SUPPLIES,Envelopes
OFF-EN-10000824,"GlobeWeis Manila Envelope, Security-Tint",OFFICE SUPPLIES,Envelopes
OFF-EN-10000826,"GlobeWeis Manila Envelope, Set of 50",OFFICE SUPPLIES,Envelopes
OFF-EN-10000835,"GlobeWeis Clasp Envelope, with clear poly window",OFFICE SUPPLIES,Envelopes
OFF-EN-10000857,"Jiffy Interoffice Envelope, Set of 50",OFFICE SUPPLIES,Envelopes
OFF-EN-10000897,"Kraft Mailers, Set of 50",OFFICE SUPPLIES,Envelopes
OFF-EN-10000927,Jet-Pak Recycled Peel 'N' Seal Padded Mailers,OFFICE SUPPLIES,Envelopes
OFF-EN-10000947,"GlobeWeis Mailers, Security-Tint",OFFICE SUPPLIES,Envelopes
OFF-EN-10001044,"Kraft Manila Envelope, Set of 50",OFFICE SUPPLIES,Envelopes
OFF-EN-10001109,"Jiffy Manila Envelope, Set of 50",OFFICE SUPPLIES,Envelopes
OFF-EN-10001136,"Kraft Interoffice Envelope, Recycled",OFFICE SUPPLIES,Envelopes
OFF-EN-10001137,"#10 Gummed Flap White Envelopes, 100/Box",OFFICE SUPPLIES,Envelopes
OFF-EN-10001141,"Manila Recycled Extra-Heavyweight Clasp Envelopes, 6"" x 9""",OFFICE SUPPLIES,Envelopes
OFF-EN-10001154,"Kraft Clasp Envelope, Set of 50",OFFICE SUPPLIES,Envelopes
OFF-EN-10001162,"GlobeWeis Mailers, Set of 50",OFFICE SUPPLIES,Envelopes
OFF-EN-10001202,"Kraft Clasp Envelope, with clear poly window",OFFICE SUPPLIES,Envelopes
OFF-EN-10001219,"#10- 4 1/8"" x 9 1/2"" Security-Tint Envelopes",OFFICE SUPPLIES,Envelopes
OFF-EN-10001311,"GlobeWeis Business Envelopes, with clear poly window",OFFICE SUPPLIES,Envelopes
OFF-EN-10001335,"White Business Envelopes with Contemporary Seam, Recycled White Business Envelopes",OFFICE SUPPLIES,Envelopes
OFF-EN-10001375,"GlobeWeis Mailers, with clear poly window",OFFICE SUPPLIES,Envelopes
OFF-EN-10001434,"Strathmore #10 Envelopes, Ultimate White",OFFICE SUPPLIES,Envelopes
OFF-EN-10001443,"Jiffy Business Envelopes, Recycled",OFFICE SUPPLIES,Envelopes
OFF-EN-10001449,"Kraft Manila Envelope, with clear poly window",OFFICE SUPPLIES,Envelopes
OFF-EN-10001453,"Tyvek Interoffice Envelopes, 9 1/2"" x 12 1/2"", 100/Box",OFFICE SUPPLIES,Envelopes
OFF-EN-10001509,Poly String Tie Envelopes,OFFICE SUPPLIES,Envelopes
OFF-EN-10001532,Brown Kraft Recycled Envelopes,OFFICE SUPPLIES,Envelopes
OFF-EN-10001533,"Kraft Mailers, with clear poly window",OFFICE SUPPLIES,Envelopes
OFF-EN-10001535,Grip Seal Envelopes,OFFICE SUPPLIES,Envelopes
OFF-EN-10001538,"Jiffy Peel and Seal, Recycled",OFFICE SUPPLIES,Envelopes
OFF-EN-10001616,"GlobeWeis Business Envelopes, Recycled",OFFICE SUPPLIES,Envelopes
OFF-EN-10001728,"Jiffy Interoffice Envelope, Recycled",OFFICE SUPPLIES,Envelopes
OFF-EN-10001749,Jiffy Padded Mailers with Self-Seal Closure,OFFICE SUPPLIES,Envelopes
OFF-EN-10001789,"Kraft Peel and Seal, Set of 50",OFFICE SUPPLIES,Envelopes
OFF-EN-10001870,"Kraft Peel and Seal, Security-Tint",OFFICE SUPPLIES,Envelopes
OFF-EN-10001939,"Kraft Manila Envelope, Security-Tint",OFFICE SUPPLIES,Envelopes
OFF-EN-10001946,"Kraft Mailers, Security-Tint",OFFICE SUPPLIES,Envelopes
OFF-EN-10001958,"GlobeWeis Clasp Envelope, Security-Tint",OFFICE SUPPLIES,Envelopes
OFF-EN-10001975,"Kraft Business Envelopes, Security-Tint",OFFICE SUPPLIES,Envelopes
OFF-EN-10002066,"Kraft Interoffice Envelope, with clear poly window",OFFICE SUPPLIES,Envelopes
OFF-EN-10002096,"GlobeWeis Mailers, Recycled",OFFICE SUPPLIES,Envelopes
OFF-EN-10002230,Airmail Envelopes,OFFICE SUPPLIES,Envelopes
OFF-EN-10002263,"GlobeWeis Interoffice Envelope, with clear poly window",OFFICE SUPPLIES,Envelopes
OFF-EN-10002312,#10 Self-Seal White Envelopes,OFFICE SUPPLIES,Envelopes
OFF-EN-10002410,"GlobeWeis Manila Envelope, Recycled",OFFICE SUPPLIES,Envelopes
OFF-EN-10002500,Globe Weis Peel & Seel First Class Envelopes,OFFICE SUPPLIES,Envelopes
OFF-EN-10002504,"Tyvek  Top-Opening Peel & Seel Envelopes, Plain White",OFFICE SUPPLIES,Envelopes
OFF-EN-10002592,"Peel & Seel Recycled Catalog Envelopes, Brown",OFFICE SUPPLIES,Envelopes
OFF-EN-10002600,"Redi-Strip #10 Envelopes, 4 1/8 x 9 1/2",OFFICE SUPPLIES,Envelopes
OFF-EN-10002831,"Tyvek  Top-Opening Peel & Seel  Envelopes, Gray",OFFICE SUPPLIES,Envelopes
OFF-EN-10002896,"Jiffy Business Envelopes, Set of 50",OFFICE SUPPLIES,Envelopes
OFF-EN-10002955,"Jiffy Interoffice Envelope, with clear poly window",OFFICE SUPPLIES,Envelopes
OFF-EN-10002973,Ampad #10 Peel & Seel Holiday Envelopes,OFFICE SUPPLIES,Envelopes
OFF-EN-10002986,"#10-4 1/8"" x 9 1/2"" Premium Diagonal Seam Envelopes",OFFICE SUPPLIES,Envelopes
OFF-EN-10003001,Ames Color-File Green Diamond Border X-ray Mailers,OFFICE SUPPLIES,Envelopes
OFF-EN-10003040,Quality Park Security Envelopes,OFFICE SUPPLIES,Envelopes
OFF-EN-10003055,"Blue String-Tie & Button Interoffice Envelopes, 10 x 13",OFFICE SUPPLIES,Envelopes
OFF-EN-10003068,#6 3/4 Gummed Flap White Envelopes,OFFICE SUPPLIES,Envelopes
OFF-EN-10003072,Peel & Seel Envelopes,OFFICE SUPPLIES,Envelopes
OFF-EN-10003111,"GlobeWeis Clasp Envelope, Recycled",OFFICE SUPPLIES,Envelopes
OFF-EN-10003160,Pastel Pink Envelopes,OFFICE SUPPLIES,Envelopes
OFF-EN-10003296,Tyvek Side-Opening Peel & Seel Expanding Envelopes,OFFICE SUPPLIES,Envelopes
OFF-EN-10003299,"Cameo Mailers, Security-Tint",OFFICE SUPPLIES,Envelopes
OFF-EN-10003373,"GlobeWeis Interoffice Envelope, Recycled",OFFICE SUPPLIES,Envelopes
OFF-EN-10003567,"Inter-Office Recycled Envelopes, Brown Kraft, Button-String,10"" x 13"" , 100/Box",OFFICE SUPPLIES,Envelopes
OFF-EN-10003632,"Jiffy Mailers, Recycled",OFFICE SUPPLIES,Envelopes
OFF-EN-10003798,"Recycled Interoffice Envelopes with Re-Use-A-Seal Closure, 10 x 13",OFFICE SUPPLIES,Envelopes
OFF-EN-10003845,Colored Envelopes,OFFICE SUPPLIES,Envelopes
OFF-EN-10003858,"Jiffy Manila Envelope, Recycled",OFFICE SUPPLIES,Envelopes
OFF-EN-10003862,Laser & Ink Jet Business Envelopes,OFFICE SUPPLIES,Envelopes
OFF-EN-10004007,Park Ridge Embossed Executive Business Envelopes,OFFICE SUPPLIES,Envelopes
OFF-EN-10004030,Convenience Packs of Business Envelopes,OFFICE SUPPLIES,Envelopes
OFF-EN-10004147,Wausau Papers Astrobrights Colored Envelopes,OFFICE SUPPLIES,Envelopes
OFF-EN-10004206,Multimedia Mailers,OFFICE SUPPLIES,Envelopes
OFF-EN-10004386,"Recycled Interoffice Envelopes with String and Button Closure, 10 x 13",OFFICE SUPPLIES,Envelopes
OFF-EN-10004459,Security-Tint Envelopes,OFFICE SUPPLIES,Envelopes
OFF-EN-10004483,"#10 White Business Envelopes,4 1/8 x 9 1/2",OFFICE SUPPLIES,Envelopes
OFF-EN-10004503,"GlobeWeis Peel and Seal, Security-Tint",OFFICE SUPPLIES,Envelopes
OFF-EN-10004846,Letter or Legal Size Expandable Poly String Tie Envelopes,OFFICE SUPPLIES,Envelopes
OFF-EN-10004955,Fashion Color Clasp Envelopes,OFFICE SUPPLIES,Envelopes
OFF-ENE-10000012,"Enermax Computer Printout Paper, Recycled",OFFICE SUPPLIES,Paper
OFF-ENE-10000199,"Enermax Computer Printout Paper, Multicolor",OFFICE SUPPLIES,Paper
OFF-ENE-10000516,"Enermax Note Cards, Multicolor",OFFICE SUPPLIES,Paper
OFF-ENE-10000935,"Enermax Memo Slips, Premium",OFFICE SUPPLIES,Paper
OFF-ENE-10001117,"Enermax Message Books, 8.5 x 11",OFFICE SUPPLIES,Paper
OFF-ENE-10001291,"Enermax Computer Printout Paper, Premium",OFFICE SUPPLIES,Paper
OFF-ENE-10001356,"Enermax Cards & Envelopes, Multicolor",OFFICE SUPPLIES,Paper
OFF-ENE-10001906,"Enermax Message Books, Recycled",OFFICE SUPPLIES,Paper
OFF-ENE-10002038,"Enermax Message Books, Premium",OFFICE SUPPLIES,Paper
OFF-ENE-10002093,"Enermax Message Books, Multicolor",OFFICE SUPPLIES,Paper
OFF-ENE-10002104,"Enermax Note Cards, Premium",OFFICE SUPPLIES,Paper
OFF-ENE-10002470,"Enermax Cards & Envelopes, 8.5 x 11",OFFICE SUPPLIES,Paper
OFF-ENE-10002784,"Enermax Parchment Paper, Multicolor",OFFICE SUPPLIES,Paper
OFF-ENE-10002833,"Enermax Cards & Envelopes, Premium",OFFICE SUPPLIES,Paper
OFF-ENE-10003066,"Enermax Memo Slips, Multicolor",OFFICE SUPPLIES,Paper
OFF-ENE-10003274,"Enermax Memo Slips, 8.5 x 11",OFFICE SUPPLIES,Paper
OFF-ENE-10003314,"Enermax Parchment Paper, Recycled",OFFICE SUPPLIES,Paper
OFF-ENE-10003409,"Enermax Memo Slips, Recycled",OFFICE SUPPLIES,Paper
OFF-ENE-10003549,"Enermax Cards & Envelopes, Recycled",OFFICE SUPPLIES,Paper
OFF-ENE-10004132,"Enermax Computer Printout Paper, 8.5 x 11",OFFICE SUPPLIES,Paper
OFF-ENE-10004377,"Enermax Note Cards, 8.5 x 11",OFFICE SUPPLIES,Paper
OFF-ENE-10004401,"Enermax Parchment Paper, Premium",OFFICE SUPPLIES,Paper
OFF-ENE-10004866,"Enermax Parchment Paper, 8.5 x 11",OFFICE SUPPLIES,Paper
OFF-FA-10000010,"OIC Staples, Metal",OFFICE SUPPLIES,Fasteners
OFF-FA-10000027,"Stockwell Rubber Bands, Bulk Pack",OFFICE SUPPLIES,Fasteners
OFF-FA-10000038,"Stockwell Clamps, Assorted Sizes",OFFICE SUPPLIES,Fasteners
OFF-FA-10000053,Revere Boxed Rubber Bands by Revere,OFFICE SUPPLIES,Fasteners
OFF-FA-10000059,"Stockwell Clamps, Bulk Pack",OFFICE SUPPLIES,Fasteners
OFF-FA-10000067,"Stockwell Staples, 12 Pack",OFFICE SUPPLIES,Fasteners
OFF-FA-10000074,"Stockwell Push Pins, Bulk Pack",OFFICE SUPPLIES,Fasteners
OFF-FA-10000089,"OIC Rubber Bands, Assorted Sizes",OFFICE SUPPLIES,Fasteners
OFF-FA-10000089,Acco Glide Clips,OFFICE SUPPLIES,Fasteners
OFF-FA-10000091,"Stockwell Push Pins, Metal",OFFICE SUPPLIES,Fasteners
OFF-FA-10000099,"Stockwell Paper Clips, Metal",OFFICE SUPPLIES,Fasteners
OFF-FA-10000134,"Stockwell Push Pins, Assorted Sizes",OFFICE SUPPLIES,Fasteners
OFF-FA-10000134,"Advantus Push Pins, Aluminum Head",OFFICE SUPPLIES,Fasteners
OFF-FA-10000146,"Stockwell Rubber Bands, Assorted Sizes",OFFICE SUPPLIES,Fasteners
OFF-FA-10000154,"OIC Paper Clips, Bulk Pack",OFFICE SUPPLIES,Fasteners
OFF-FA-10000189,"OIC Paper Clips, 12 Pack",OFFICE SUPPLIES,Fasteners
OFF-FA-10000191,"Stockwell Rubber Bands, 12 Pack",OFFICE SUPPLIES,Fasteners
OFF-FA-10000194,"OIC Push Pins, Metal",OFFICE SUPPLIES,Fasteners
OFF-FA-10000207,"OIC Clamps, Assorted Sizes",OFFICE SUPPLIES,Fasteners
OFF-FA-10000227,"OIC Clamps, Metal",OFFICE SUPPLIES,Fasteners
OFF-FA-10000254,Sterling Rubber Bands by Alliance,OFFICE SUPPLIES,Fasteners
OFF-FA-10000263,"Stockwell Thumb Tacks, Bulk Pack",OFFICE SUPPLIES,Fasteners
OFF-FA-10000304,Advantus Push Pins,OFFICE SUPPLIES,Fasteners
OFF-FA-10000349,"OIC Push Pins, 12 Pack",OFFICE SUPPLIES,Fasteners
OFF-FA-10000439,"Stockwell Thumb Tacks, Assorted Sizes",OFFICE SUPPLIES,Fasteners
OFF-FA-10000455,"Stockwell Thumb Tacks, 12 Pack",OFFICE SUPPLIES,Fasteners
OFF-FA-10000467,"Stockwell Push Pins, 12 Pack",OFFICE SUPPLIES,Fasteners
OFF-FA-10000470,"Stockwell Paper Clips, Assorted Sizes",OFFICE SUPPLIES,Fasteners
OFF-FA-10000474,"OIC Staples, 12 Pack",OFFICE SUPPLIES,Fasteners
OFF-FA-10000475,"OIC Paper Clips, Metal",OFFICE SUPPLIES,Fasteners
OFF-FA-10000487,"Stockwell Paper Clips, Bulk Pack",OFFICE SUPPLIES,Fasteners
OFF-FA-10000490,"OIC Binder Clips, Mini, 1/4"" Capacity, Black",OFFICE SUPPLIES,Fasteners
OFF-FA-10000540,"Stockwell Staples, Assorted Sizes",OFFICE SUPPLIES,Fasteners
OFF-FA-10000581,"Stockwell Thumb Tacks, Metal",OFFICE SUPPLIES,Fasteners
OFF-FA-10000585,OIC Bulk Pack Metal Binder Clips,OFFICE SUPPLIES,Fasteners
OFF-FA-10000611,Binder Clips by OIC,OFFICE SUPPLIES,Fasteners
OFF-FA-10000621,"OIC Colored Binder Clips, Assorted Sizes",OFFICE SUPPLIES,Fasteners
OFF-FA-10000624,OIC Binder Clips,OFFICE SUPPLIES,Fasteners
OFF-FA-10000659,"Stockwell Clamps, 12 Pack",OFFICE SUPPLIES,Fasteners
OFF-FA-10000700,"OIC Thumb Tacks, 12 Pack",OFFICE SUPPLIES,Fasteners
OFF-FA-10000799,"OIC Push Pins, Bulk Pack",OFFICE SUPPLIES,Fasteners
OFF-FA-10000840,OIC Thumb-Tacks,OFFICE SUPPLIES,Fasteners
OFF-FA-10000907,"OIC Rubber Bands, Bulk Pack",OFFICE SUPPLIES,Fasteners
OFF-FA-10000936,Acco Hot Clips Clips to Go,OFFICE SUPPLIES,Fasteners
