PRODUCT_ID,PRODUCT_NAME,CATEGORY,SUB_CATEGORY
FUR-ADV-10000002,"Advantus Photo Frame, Duo Pack",FURNITURE,Furnishings
FUR-ADV-10000108,"Advantus Clock, Erganomic",FURNITURE,Furnishings
FUR-ADV-10000183,"Advantus Photo Frame, Black",FURNITURE,Furnishings
FUR-ADV-10000188,"Advantus Stacking Tray, Erganomic",FURNITURE,Furnishings
FUR-ADV-10000190,"Advantus Frame, Duo Pack",FURNITURE,Furnishings
FUR-ADV-10000571,"Advantus Frame, Erganomic",FURNITURE,Furnishings
FUR-ADV-10000600,"Advantus Clock, Duo Pack",FURNITURE,Furnishings
FUR-ADV-10000847,"Advantus Stacking Tray, Black",FURNITURE,Furnishings
FUR-ADV-10001283,"Advantus Frame, Black",FURNITURE,Furnishings
FUR-ADV-10001440,"Advantus Door Stop, Black",FURNITURE,Furnishings
FUR-ADV-10001659,"Advantus Light Bulb, Durable",FURNITURE,Furnishings
FUR-ADV-10001855,"Advantus Stacking Tray, Durable",FURNITURE,Furnishings
FUR-ADV-10002329,"Advantus Light Bulb, Erganomic",FURNITURE,Furnishings
FUR-ADV-10002601,"Advantus Photo Frame, Erganomic",FURNITURE,Furnishings
FUR-ADV-10002632,"Advantus Door Stop, Duo Pack",FURNITURE,Furnishings
FUR-ADV-10002889,"Advantus Clock, Durable",FURNITURE,Furnishings
FUR-ADV-10003326,"Advantus Light Bulb, Black",FURNITURE,Furnishings
FUR-ADV-10004159,"Advantus Frame, Durable",FURNITURE,Furnishings
FUR-ADV-10004223,"Advantus Clock, Black",FURNITURE,Furnishings
FUR-ADV-10004395,"Advantus Door Stop, Durable",FURNITURE,Furnishings
FUR-ADV-10004499,"Advantus Photo Frame, Durable",FURNITURE,Furnishings
FUR-ADV-10004718,"Advantus Light Bulb, Duo Pack",FURNITURE,Furnishings
FUR-ADV-10004971,"Advantus Door Stop, Erganomic",FURNITURE,Furnishings
FUR-BAR-10000560,"Barricks Round Table, with Bottom Storage",FURNITURE,Tables
FUR-BAR-10000831,"Barricks Training Table, Fully Assembled",FURNITURE,Tables
FUR-BAR-10000946,"Barricks Computer Table, with Bottom Storage",FURNITURE,Tables
FUR-BAR-10001039,"Barricks Coffee Table, Fully Assembled",FURNITURE,Tables
FUR-BAR-10002449,"Barricks Training Table, Adjustable Height",FURNITURE,Tables
FUR-BAR-10002710,"Barricks Coffee Table, Adjustable Height",FURNITURE,Tables
FUR-BAR-10003465,"Barricks Computer Table, Adjustable Height",FURNITURE,Tables
FUR-BAR-10003532,"Barricks Conference Table, Rectangular",FURNITURE,Tables
FUR-BAR-10003576,"Barricks Training Table, with Bottom Storage",FURNITURE,Tables
FUR-BAR-10004434,"Barricks Wood Table, Rectangular",FURNITURE,Tables
FUR-BAR-10004553,"Barricks Training Table, Rectangular",FURNITURE,Tables
FUR-BAR-10004561,"Barricks Wood Table, Fully Assembled",FURNITURE,Tables
FUR-BAR-10004682,"Barricks Round Table, Fully Assembled",FURNITURE,Tables
FUR-BEV-10000326,"Bevis Wood Table, Rectangular",FURNITURE,Tables
FUR-BEV-10000388,"Bevis Coffee Table, Rectangular",FURNITURE,Tables
FUR-BEV-10001048,"Bevis Conference Table, with Bottom Storage",FURNITURE,Tables
FUR-BEV-10001217,"Bevis Wood Table, Fully Assembled",FURNITURE,Tables
FUR-BEV-10001853,"Bevis Computer Table, Adjustable Height",FURNITURE,Tables
FUR-BEV-10002193,"Bevis Round Table, Adjustable Height",FURNITURE,Tables
FUR-BEV-10002369,"Bevis Training Table, Fully Assembled",FURNITURE,Tables
FUR-BEV-10002803,"Bevis Conference Table, Fully Assembled",FURNITURE,Tables
FUR-BEV-10003414,"Bevis Computer Table, Fully Assembled",FURNITURE,Tables
FUR-BEV-10004805,"Bevis Conference Table, Rectangular",FURNITURE,Tables
FUR-BEV-10004919,"Bevis Wood Table, with Bottom Storage",FURNITURE,Tables
FUR-BO-10000002,"Bush Classic Bookcase, Mobile",FURNITURE,Bookcases
FUR-BO-10000008,"Sauder Library with Doors, Traditional",FURNITURE,Bookcases
FUR-BO-10000021,"Dania Corner Shelving, Metal",FURNITURE,Bookcases
FUR-BO-10000022,"Dania Floating Shelf Set, Traditional",FURNITURE,Bookcases
FUR-BO-10000034,"Safco Classic Bookcase, Pine",FURNITURE,Bookcases
FUR-BO-10000035,"Dania Classic Bookcase, Pine",FURNITURE,Bookcases
FUR-BO-10000038,"Bush Library with Doors, Pine",FURNITURE,Bookcases
FUR-BO-10000071,"Safco 3-Shelf Cabinet, Metal",FURNITURE,Bookcases
FUR-BO-10000087,"Sauder Corner Shelving, Pine",FURNITURE,Bookcases
FUR-BO-10000087,"Dania Classic Bookcase, Mobile",FURNITURE,Bookcases
FUR-BO-10000112,"Dania Corner Shelving, Pine",FURNITURE,Bookcases
FUR-BO-10000112,"Bush Birmingham Collection Bookcase, Dark Cherry",FURNITURE,Bookcases
FUR-BO-10000120,"Sauder Stackable Bookrack, Mobile",FURNITURE,Bookcases
FUR-BO-10000148,"Bush 3-Shelf Cabinet, Metal",FURNITURE,Bookcases
FUR-BO-10000160,"Safco Library with Doors, Pine",FURNITURE,Bookcases
FUR-BO-10000170,"Safco Library with Doors, Mobile",FURNITURE,Bookcases
FUR-BO-10000175,"Ikea Stackable Bookrack, Metal",FURNITURE,Bookcases
FUR-BO-10000184,"Sauder Floating Shelf Set, Mobile",FURNITURE,Bookcases
FUR-BO-10000195,"Dania Stackable Bookrack, Pine",FURNITURE,Bookcases
FUR-BO-10000203,"Sauder Library with Doors, Metal",FURNITURE,Bookcases
FUR-BO-10000208,"Bush Stackable Bookrack, Mobile",FURNITURE,Bookcases
FUR-BO-10000210,"Ikea Library with Doors, Pine",FURNITURE,Bookcases
FUR-BO-10000243,"Safco Floating Shelf Set, Pine",FURNITURE,Bookcases
FUR-BO-10000259,"Safco Classic Bookcase, Traditional",FURNITURE,Bookcases
FUR-BO-10000265,"Bush Floating Shelf Set, Pine",FURNITURE,Bookcases
FUR-BO-10000268,"Ikea 3-Shelf Cabinet, Traditional",FURNITURE,Bookcases
FUR-BO-10000311,"Safco Floating Shelf Set, Metal",FURNITURE,Bookcases
FUR-BO-10000321,"Dania Floating Shelf Set, Mobile",FURNITURE,Bookcases
FUR-BO-10000330,"Sauder Camden County Barrister Bookcase, Planked Cherry Finish",FURNITURE,Bookcases
FUR-BO-10000362,Sauder Inglewood Library Bookcases,FURNITURE,Bookcases
FUR-BO-10000402,"Sauder Stackable Bookrack, Traditional",FURNITURE,Bookcases
FUR-BO-10000411,"Sauder Floating Shelf Set, Metal",FURNITURE,Bookcases
FUR-BO-10000425,"Bush Floating Shelf Set, Traditional",FURNITURE,Bookcases
FUR-BO-10000468,O'Sullivan 2-Shelf Heavy-Duty Bookcases,FURNITURE,Bookcases
FUR-BO-10000490,"Bush Library with Doors, Metal",FURNITURE,Bookcases
FUR-BO-10000502,"Sauder Classic Bookcase, Mobile",FURNITURE,Bookcases
FUR-BO-10000514,"Bush Library with Doors, Traditional",FURNITURE,Bookcases
FUR-BO-10000567,"Sauder Classic Bookcase, Traditional",FURNITURE,Bookcases
FUR-BO-10000610,"Ikea Stackable Bookrack, Mobile",FURNITURE,Bookcases
FUR-BO-10000623,"Safco Library with Doors, Metal",FURNITURE,Bookcases
FUR-BO-10000624,"Safco Classic Bookcase, Metal",FURNITURE,Bookcases
FUR-BO-10000636,"Dania Floating Shelf Set, Metal",FURNITURE,Bookcases
FUR-BO-10000655,"Dania Classic Bookcase, Traditional",FURNITURE,Bookcases
FUR-BO-10000666,"Ikea 3-Shelf Cabinet, Mobile",FURNITURE,Bookcases
FUR-BO-10000668,"Ikea Corner Shelving, Traditional",FURNITURE,Bookcases
FUR-BO-10000676,"Bush Stackable Bookrack, Pine",FURNITURE,Bookcases
FUR-BO-10000684,"Sauder Corner Shelving, Traditional",FURNITURE,Bookcases
FUR-BO-10000699,"Sauder 3-Shelf Cabinet, Traditional",FURNITURE,Bookcases
FUR-BO-10000711,"Hon Metal Bookcases, Gray",FURNITURE,Bookcases
FUR-BO-10000712,"Bush Corner Shelving, Pine",FURNITURE,Bookcases
FUR-BO-10000728,"Dania Corner Shelving, Traditional",FURNITURE,Bookcases
FUR-BO-10000728,"Ikea Classic Bookcase, Mobile",FURNITURE,Bookcases
FUR-BO-10000746,"Ikea Corner Shelving, Mobile",FURNITURE,Bookcases
FUR-BO-10000780,O'Sullivan Plantations 2-Door Library in Landvery Oak,FURNITURE,Bookcases
FUR-BO-10000786,"Sauder Stackable Bookrack, Pine",FURNITURE,Bookcases
FUR-BO-10000791,"Dania Library with Doors, Traditional",FURNITURE,Bookcases
FUR-BO-10000797,"Safco 3-Shelf Cabinet, Pine",FURNITURE,Bookcases
FUR-BO-10000820,"Sauder 3-Shelf Cabinet, Metal",FURNITURE,Bookcases
FUR-BO-10000847,"Dania Stackable Bookrack, Mobile",FURNITURE,Bookcases
FUR-BO-10000883,"Dania Corner Shelving, Mobile",FURNITURE,Bookcases
FUR-BO-10000889,"Safco 3-Shelf Cabinet, Mobile",FURNITURE,Bookcases
FUR-BO-10000891,"Ikea Classic Bookcase, Pine",FURNITURE,Bookcases
FUR-BO-10000892,"Bush Corner Shelving, Mobile",FURNITURE,Bookcases
FUR-BO-10000895,"Sauder Corner Shelving, Metal",FURNITURE,Bookcases
FUR-BO-10001003,"Dania 3-Shelf Cabinet, Traditional",FURNITURE,Bookcases
FUR-BO-10001042,"Dania 3-Shelf Cabinet, Pine",FURNITURE,Bookcases
FUR-BO-10001099,"Bush Corner Shelving, Traditional",FURNITURE,Bookcases
FUR-BO-10001147,"Bush Floating Shelf Set, Metal",FURNITURE,Bookcases
FUR-BO-10001155,"Ikea 3-Shelf Cabinet, Metal",FURNITURE,Bookcases
FUR-BO-10001165,"Bush Library with Doors, Mobile",FURNITURE,Bookcases
FUR-BO-10001212,"Safco Classic Bookcase, Mobile",FURNITURE,Bookcases
FUR-BO-10001216,"Sauder 3-Shelf Cabinet, Mobile",FURNITURE,Bookcases
FUR-BO-10001254,"Dania 3-Shelf Cabinet, Mobile",FURNITURE,Bookcases
FUR-BO-10001255,"Ikea Library with Doors, Mobile",FURNITURE,Bookcases
FUR-BO-10001256,"Ikea Corner Shelving, Pine",FURNITURE,Bookcases
FUR-BO-10001271,"Sauder Classic Bookcase, Pine",FURNITURE,Bookcases
FUR-BO-10001276,"Safco Floating Shelf Set, Mobile",FURNITURE,Bookcases
FUR-BO-10001295,"Safco Floating Shelf Set, Traditional",FURNITURE,Bookcases
FUR-BO-10001309,"Ikea Classic Bookcase, Traditional",FURNITURE,Bookcases
FUR-BO-10001324,"Sauder Floating Shelf Set, Pine",FURNITURE,Bookcases
FUR-BO-10001326,"Bush 3-Shelf Cabinet, Pine",FURNITURE,Bookcases
FUR-BO-10001337,O'Sullivan Living Dimensions 2-Shelf Bookcases,FURNITURE,Bookcases
FUR-BO-10001342,"Safco Corner Shelving, Metal",FURNITURE,Bookcases
FUR-BO-10001358,"Bush 3-Shelf Cabinet, Traditional",FURNITURE,Bookcases
FUR-BO-10001362,"Ikea Classic Bookcase, Metal",FURNITURE,Bookcases
FUR-BO-10001471,"Sauder Classic Bookcase, Metal",FURNITURE,Bookcases
FUR-BO-10001476,"Safco Corner Shelving, Pine",FURNITURE,Bookcases
FUR-BO-10001483,"Bush Corner Shelving, Metal",FURNITURE,Bookcases
FUR-BO-10001501,"Bush Classic Bookcase, Metal",FURNITURE,Bookcases
FUR-BO-10001507,"Ikea Library with Doors, Traditional",FURNITURE,Bookcases
FUR-BO-10001519,O'Sullivan 3-Shelf Heavy-Duty Bookcases,FURNITURE,Bookcases
FUR-BO-10001537,"Ikea Corner Shelving, Metal",FURNITURE,Bookcases
FUR-BO-10001541,"Bush Stackable Bookrack, Traditional",FURNITURE,Bookcases
FUR-BO-10001567,"Bush Westfield Collection Bookcases, Dark Cherry Finish, Fully Assembled",FURNITURE,Bookcases
FUR-BO-10001585,"Ikea Floating Shelf Set, Traditional",FURNITURE,Bookcases
FUR-BO-10001596,"Dania Library with Doors, Mobile",FURNITURE,Bookcases
FUR-BO-10001601,"Sauder Mission Library with Doors, Fruitwood Finish",FURNITURE,Bookcases
FUR-BO-10001608,"Hon Metal Bookcases, Black",FURNITURE,Bookcases
FUR-BO-10001619,O'Sullivan Cherrywood Estates Traditional Bookcase,FURNITURE,Bookcases
FUR-BO-10001621,"Dania Stackable Bookrack, Traditional",FURNITURE,Bookcases
FUR-BO-10001668,"Ikea Floating Shelf Set, Pine",FURNITURE,Bookcases
FUR-BO-10001708,"Safco Stackable Bookrack, Pine",FURNITURE,Bookcases
FUR-BO-10001749,"Bush Classic Bookcase, Traditional",FURNITURE,Bookcases
FUR-BO-10001798,Bush Somerset Collection Bookcase,FURNITURE,Bookcases
FUR-BO-10001811,"Atlantic Metals Mobile 5-Shelf Bookcases, Custom Colors",FURNITURE,Bookcases
FUR-BO-10001822,"Dania Library with Doors, Metal",FURNITURE,Bookcases
FUR-BO-10001835,"Safco Library with Doors, Traditional",FURNITURE,Bookcases
FUR-BO-10001873,"Ikea Floating Shelf Set, Mobile",FURNITURE,Bookcases
FUR-BO-10001888,"Dania Floating Shelf Set, Pine",FURNITURE,Bookcases
FUR-BO-10001892,"Sauder Library with Doors, Pine",FURNITURE,Bookcases
FUR-BO-10001918,"Sauder Forest Hills Library with Doors, Woodland Oak Finish",FURNITURE,Bookcases
FUR-BO-10001967,"Safco Corner Shelving, Mobile",FURNITURE,Bookcases
FUR-BO-10001969,"Sauder 3-Shelf Cabinet, Pine",FURNITURE,Bookcases
FUR-BO-10001972,O'Sullivan 4-Shelf Bookcase in Odessa Pine,FURNITURE,Bookcases
FUR-BO-10002032,"Ikea Stackable Bookrack, Pine",FURNITURE,Bookcases
FUR-BO-10002202,"Atlantic Metals Mobile 2-Shelf Bookcases, Custom Colors",FURNITURE,Bookcases
FUR-BO-10002204,"Bush Classic Bookcase, Pine",FURNITURE,Bookcases
FUR-BO-10002206,"Bush Saratoga Collection 5-Shelf Bookcase, Hanover Cherry, *Special Order",FURNITURE,Bookcases
FUR-BO-10002213,DMI Eclipse Executive Suite Bookcases,FURNITURE,Bookcases
FUR-BO-10002213,"Sauder Forest Hills Library, Woodland Oak Finish",FURNITURE,Bookcases
FUR-BO-10002268,Sauder Barrister Bookcases,FURNITURE,Bookcases
FUR-BO-10002277,"Bush Floating Shelf Set, Mobile",FURNITURE,Bookcases
FUR-BO-10002334,"Ikea 3-Shelf Cabinet, Pine",FURNITURE,Bookcases
FUR-BO-10002378,"Dania 3-Shelf Cabinet, Metal",FURNITURE,Bookcases
FUR-BO-10002390,"Ikea Library with Doors, Metal",FURNITURE,Bookcases
FUR-BO-10002444,"Sauder Library with Doors, Mobile",FURNITURE,Bookcases
FUR-BO-10002510,"Bush 3-Shelf Cabinet, Mobile",FURNITURE,Bookcases
FUR-BO-10002510,"Safco 3-Shelf Cabinet, Traditional",FURNITURE,Bookcases
FUR-BO-10002545,"Atlantic Metals Mobile 3-Shelf Bookcases, Custom Colors",FURNITURE,Bookcases
FUR-BO-10002592,"Safco Stackable Bookrack, Traditional",FURNITURE,Bookcases
FUR-BO-10002598,"Hon Metal Bookcases, Putty",FURNITURE,Bookcases
FUR-BO-10002613,"Atlantic Metals Mobile 4-Shelf Bookcases, Custom Colors",FURNITURE,Bookcases
FUR-BO-10002682,"Safco Stackable Bookrack, Mobile",FURNITURE,Bookcases
FUR-BO-10002708,"Dania Library with Doors, Pine",FURNITURE,Bookcases
FUR-BO-10002738,"Sauder Corner Shelving, Mobile",FURNITURE,Bookcases
FUR-BO-10002781,"Sauder Floating Shelf Set, Traditional",FURNITURE,Bookcases
FUR-BO-10002782,"Safco Corner Shelving, Traditional",FURNITURE,Bookcases
FUR-BO-10002819,"Ikea Stackable Bookrack, Traditional",FURNITURE,Bookcases
FUR-BO-10002824,Bush Mission Pointe Library,FURNITURE,Bookcases
FUR-BO-10002853,O'Sullivan 5-Shelf Heavy-Duty Bookcases,FURNITURE,Bookcases
FUR-BO-10002916,"Rush Hierlooms Collection 1"" Thick Stackable Bookcases",FURNITURE,Bookcases
FUR-BO-10003034,"O'Sullivan Elevations Bookcase, Cherry Finish",FURNITURE,Bookcases
FUR-BO-10003159,"Sauder Camden County Collection Libraries, Planked Cherry Finish",FURNITURE,Bookcases
FUR-BO-10003185,"Ikea Floating Shelf Set, Metal",FURNITURE,Bookcases
FUR-BO-10003272,O'Sullivan Living Dimensions 5-Shelf Bookcases,FURNITURE,Bookcases
FUR-BO-10003320,"Dania Classic Bookcase, Metal",FURNITURE,Bookcases
FUR-BO-10003404,"Global Adaptabilites Bookcase, Cherry/Storm Gray Finish",FURNITURE,Bookcases
FUR-BO-10003433,Sauder Cornerstone Collection Library,FURNITURE,Bookcases
FUR-BO-10003441,"Bush Westfield Collection Bookcases, Fully Assembled",FURNITURE,Bookcases
FUR-BO-10003450,"Bush Westfield Collection Bookcases, Dark Cherry Finish",FURNITURE,Bookcases
FUR-BO-10003546,Hon 4-Shelf Metal Bookcases,FURNITURE,Bookcases
FUR-BO-10003660,"Bush Cubix Collection Bookcases, Fully Assembled",FURNITURE,Bookcases
FUR-BO-10003893,Sauder Camden County Collection Library,FURNITURE,Bookcases
FUR-BO-10003894,"Safco Value Mate Steel Bookcase, Baked Enamel Finish on Steel, Black",FURNITURE,Bookcases
FUR-BO-10003965,O'Sullivan Manor Hill 2-Door Library in Brianna Oak,FURNITURE,Bookcases
FUR-BO-10003966,"Sauder Facets Collection Library, Sky Alder Finish",FURNITURE,Bookcases
FUR-BO-10004015,"Bush Andora Bookcase, Maple/Graphite Gray Finish",FURNITURE,Bookcases
FUR-BO-10004218,"Bush Heritage Pine Collection 5-Shelf Bookcase, Albany Pine Finish, *Special Order",FURNITURE,Bookcases
FUR-BO-10004357,O'Sullivan Living Dimensions 3-Shelf Bookcases,FURNITURE,Bookcases
FUR-BO-10004360,Rush Hierlooms Collection Rich Wood Bookcases,FURNITURE,Bookcases
FUR-BO-10004409,"Safco Value Mate Series Steel Bookcases, Baked Enamel Finish on Steel, Gray",FURNITURE,Bookcases
FUR-BO-10004467,Bestar Classic Bookcase,FURNITURE,Bookcases
FUR-BO-10004690,O'Sullivan Cherrywood Estates Traditional Barrister Bookcase,FURNITURE,Bookcases
FUR-BO-10004695,O'Sullivan 2-Door Barrister Bookcase in Odessa Pine,FURNITURE,Bookcases
FUR-BO-10004709,"Bush Westfield Collection Bookcases, Medium Cherry Finish",FURNITURE,Bookcases
FUR-BO-10004834,"Riverside Palais Royal Lawyers Bookcase, Royale Cherry Finish",FURNITURE,Bookcases
FUR-CH-10000005,"Office Star Executive Leather Armchair, Adjustable",FURNITURE,Chairs
FUR-CH-10000013,"Hon Steel Folding Chair, Black",FURNITURE,Chairs
FUR-CH-10000015,Hon Multipurpose Stacking Arm Chairs,FURNITURE,Chairs
FUR-CH-10000025,"Office Star Rocking Chair, Set of Two",FURNITURE,Chairs
FUR-CH-10000026,"SAFCO Rocking Chair, Black",FURNITURE,Chairs
FUR-CH-10000027,"SAFCO Executive Leather Armchair, Black",FURNITURE,Chairs
FUR-CH-10000042,"Harbour Creations Swivel Stool, Black",FURNITURE,Chairs
FUR-CH-10000051,"Harbour Creations Executive Leather Armchair, Black",FURNITURE,Chairs
FUR-CH-10000068,"Office Star Steel Folding Chair, Red",FURNITURE,Chairs
FUR-CH-10000089,"Hon Rocking Chair, Black",FURNITURE,Chairs
FUR-CH-10000105,"Novimex Bag Chairs, Black",FURNITURE,Chairs
FUR-CH-10000105,"Hon Steel Folding Chair, Set of Two",FURNITURE,Chairs
FUR-CH-10000110,"Hon Bag Chairs, Red",FURNITURE,Chairs
FUR-CH-10000117,"Novimex Steel Folding Chair, Black",FURNITURE,Chairs
FUR-CH-10000133,"Harbour Creations Steel Folding Chair, Black",FURNITURE,Chairs
FUR-CH-10000136,"Harbour Creations Steel Folding Chair, Set of Two",FURNITURE,Chairs
FUR-CH-10000155,Global Comet Stacking Armless Chair,FURNITURE,Chairs
FUR-CH-10000171,"SAFCO Steel Folding Chair, Adjustable",FURNITURE,Chairs
FUR-CH-10000182,"Office Star Bag Chairs, Adjustable",FURNITURE,Chairs
FUR-CH-10000187,"Hon Chairmat, Red",FURNITURE,Chairs
FUR-CH-10000213,"Hon Swivel Stool, Red",FURNITURE,Chairs
FUR-CH-10000214,"Hon Rocking Chair, Set of Two",FURNITURE,Chairs
FUR-CH-10000214,"Harbour Creations Bag Chairs, Black",FURNITURE,Chairs
FUR-CH-10000225,"Global Geo Office Task Chair, Gray",FURNITURE,Chairs
FUR-CH-10000229,Global Enterprise Series Seating High-Back Swivel/Tilt Chairs,FURNITURE,Chairs
FUR-CH-10000233,"SAFCO Chairmat, Red",FURNITURE,Chairs
FUR-CH-10000265,"Office Star Chairmat, Adjustable",FURNITURE,Chairs
FUR-CH-10000294,"Office Star Swivel Stool, Red",FURNITURE,Chairs
FUR-CH-10000302,"Novimex Rocking Chair, Red",FURNITURE,Chairs
FUR-CH-10000309,Global Comet Stacking Arm Chair,FURNITURE,Chairs
FUR-CH-10000326,"SAFCO Rocking Chair, Red",FURNITURE,Chairs
FUR-CH-10000333,"SAFCO Swivel Stool, Black",FURNITURE,Chairs
FUR-CH-10000336,"SAFCO Chairmat, Set of Two",FURNITURE,Chairs
FUR-CH-10000343,"Hon Executive Leather Armchair, Black",FURNITURE,Chairs
FUR-CH-10000351,"Novimex Chairmat, Set of Two",FURNITURE,Chairs
FUR-CH-10000391,"Novimex Bag Chairs, Red",FURNITURE,Chairs
FUR-CH-10000399,"Hon Swivel Stool, Set of Two",FURNITURE,Chairs
FUR-CH-10000414,"Novimex Chairmat, Black",FURNITURE,Chairs
FUR-CH-10000422,Global Highback Leather Tilter in Burgundy,FURNITURE,Chairs
FUR-CH-10000423,"Hon Chairmat, Set of Two",FURNITURE,Chairs
FUR-CH-10000430,"SAFCO Rocking Chair, Set of Two",FURNITURE,Chairs
FUR-CH-10000430,"SAFCO Swivel Stool, Red",FURNITURE,Chairs
FUR-CH-10000432,"Harbour Creations Swivel Stool, Adjustable",FURNITURE,Chairs
FUR-CH-10000438,"Novimex Chairmat, Adjustable",FURNITURE,Chairs
FUR-CH-10000454,"Hon Deluxe Fabric Upholstered Stacking Chairs, Rounded Back",FURNITURE,Chairs
FUR-CH-10000470,"Novimex Executive Leather Armchair, Red",FURNITURE,Chairs
FUR-CH-10000479,"Harbour Creations Executive Leather Armchair, Adjustable",FURNITURE,Chairs
FUR-CH-10000488,"SAFCO Steel Folding Chair, Black",FURNITURE,Chairs
FUR-CH-10000513,High-Back Leather Manager's Chair,FURNITURE,Chairs
FUR-CH-10000528,"Novimex Steel Folding Chair, Adjustable",FURNITURE,Chairs
FUR-CH-10000553,"Metal Folding Chairs, Beige, 4/Carton",FURNITURE,Chairs
FUR-CH-10000568,"Hon Bag Chairs, Black",FURNITURE,Chairs
FUR-CH-10000583,"Novimex Swivel Stool, Set of Two",FURNITURE,Chairs
FUR-CH-10000595,Safco Contoured Stacking Chairs,FURNITURE,Chairs
FUR-CH-10000608,"Office Star Chairmat, Set of Two",FURNITURE,Chairs
FUR-CH-10000656,"Hon Swivel Stool, Adjustable",FURNITURE,Chairs
FUR-CH-10000660,"Novimex Executive Leather Armchair, Adjustable",FURNITURE,Chairs
FUR-CH-10000663,"Hon Steel Folding Chair, Adjustable",FURNITURE,Chairs
FUR-CH-10000665,"Global Airflow Leather Mesh Back Chair, Black",FURNITURE,Chairs
FUR-CH-10000666,"SAFCO Chairmat, Black",FURNITURE,Chairs
FUR-CH-10000677,"Hon Steel Folding Chair, Red",FURNITURE,Chairs
FUR-CH-10000694,"Novimex Steel Folding Chair, Red",FURNITURE,Chairs
FUR-CH-10000745,"Hon Chairmat, Adjustable",FURNITURE,Chairs
FUR-CH-10000749,Office Star - Ergonomic Mid Back Chair with 2-Way Adjustable Arms,FURNITURE,Chairs
FUR-CH-10000785,Global Ergonomic Managers Chair,FURNITURE,Chairs
FUR-CH-10000788,"Hon Rocking Chair, Adjustable",FURNITURE,Chairs
FUR-CH-10000836,"SAFCO Swivel Stool, Adjustable",FURNITURE,Chairs
FUR-CH-10000843,"SAFCO Executive Leather Armchair, Set of Two",FURNITURE,Chairs
FUR-CH-10000847,Global Executive Mid-Back Manager's Chair,FURNITURE,Chairs
FUR-CH-10000857,"Harbour Creations Rocking Chair, Black",FURNITURE,Chairs
FUR-CH-10000863,Novimex Swivel Fabric Task Chair,FURNITURE,Chairs
FUR-CH-10000885,"Hon Executive Leather Armchair, Adjustable",FURNITURE,Chairs
FUR-CH-10000892,"SAFCO Executive Leather Armchair, Red",FURNITURE,Chairs
FUR-CH-10000932,"Harbour Creations Executive Leather Armchair, Red",FURNITURE,Chairs
FUR-CH-10000966,"Harbour Creations Chairmat, Set of Two",FURNITURE,Chairs
FUR-CH-10000969,"Hon Executive Leather Armchair, Red",FURNITURE,Chairs
FUR-CH-10000988,Hon Olson Stacker Stools,FURNITURE,Chairs
FUR-CH-10001021,"Office Star Rocking Chair, Red",FURNITURE,Chairs
FUR-CH-10001037,"SAFCO Chairmat, Adjustable",FURNITURE,Chairs
FUR-CH-10001039,"Harbour Creations Rocking Chair, Adjustable",FURNITURE,Chairs
FUR-CH-10001043,"Harbour Creations Bag Chairs, Red",FURNITURE,Chairs
FUR-CH-10001044,"Harbour Creations Steel Folding Chair, Adjustable",FURNITURE,Chairs
FUR-CH-10001130,"Harbour Creations Swivel Stool, Set of Two",FURNITURE,Chairs
FUR-CH-10001138,"Office Star Swivel Stool, Black",FURNITURE,Chairs
FUR-CH-10001146,"Global Value Mid-Back Manager's Chair, Gray",FURNITURE,Chairs
FUR-CH-10001146,"Global Task Chair, Black",FURNITURE,Chairs
FUR-CH-10001150,"SAFCO Steel Folding Chair, Red",FURNITURE,Chairs
FUR-CH-10001153,"Harbour Creations Bag Chairs, Adjustable",FURNITURE,Chairs
FUR-CH-10001190,Global Deluxe High-Back Office Chair in Storm,FURNITURE,Chairs
FUR-CH-10001191,"Hon Bag Chairs, Adjustable",FURNITURE,Chairs
FUR-CH-10001203,"Novimex Steel Folding Chair, Set of Two",FURNITURE,Chairs
FUR-CH-10001204,"Harbour Creations Steel Folding Chair, Red",FURNITURE,Chairs
FUR-CH-10001215,Global Troy Executive Leather Low-Back Tilter,FURNITURE,Chairs
FUR-CH-10001237,"Hon Swivel Stool, Black",FURNITURE,Chairs
FUR-CH-10001270,Harbour Creations Steel Folding Chair,FURNITURE,Chairs
FUR-CH-10001317,"Harbour Creations Rocking Chair, Red",FURNITURE,Chairs
FUR-CH-10001332,"Hon Chairmat, Black",FURNITURE,Chairs
FUR-CH-10001332,"Office Star Executive Leather Armchair, Red",FURNITURE,Chairs
FUR-CH-10001343,"SAFCO Swivel Stool, Set of Two",FURNITURE,Chairs
FUR-CH-10001382,"Office Star Chairmat, Red",FURNITURE,Chairs
FUR-CH-10001394,Global Leather Executive Chair,FURNITURE,Chairs
FUR-CH-10001429,"SAFCO Executive Leather Armchair, Adjustable",FURNITURE,Chairs
FUR-CH-10001455,"Office Star Swivel Stool, Adjustable",FURNITURE,Chairs
FUR-CH-10001482,Office Star - Mesh Screen back chair with Vinyl seat,FURNITURE,Chairs
FUR-CH-10001536,"Harbour Creations Swivel Stool, Red",FURNITURE,Chairs
FUR-CH-10001536,"Harbour Creations Chairmat, Red",FURNITURE,Chairs
FUR-CH-10001545,Hon Comfortask Task/Swivel Chairs,FURNITURE,Chairs
FUR-CH-10001582,"Office Star Executive Leather Armchair, Black",FURNITURE,Chairs
FUR-CH-10001634,"Novimex Rocking Chair, Adjustable",FURNITURE,Chairs
FUR-CH-10001647,"Novimex Swivel Stool, Black",FURNITURE,Chairs
FUR-CH-10001675,"Office Star Steel Folding Chair, Adjustable",FURNITURE,Chairs
FUR-CH-10001684,"Office Star Rocking Chair, Adjustable",FURNITURE,Chairs
FUR-CH-10001708,Office Star - Contemporary Swivel Chair with Padded Adjustable Arms and Flex Back,FURNITURE,Chairs
FUR-CH-10001714,"Global Leather & Oak Executive Chair, Burgundy",FURNITURE,Chairs
FUR-CH-10001756,"Novimex Bag Chairs, Adjustable",FURNITURE,Chairs
FUR-CH-10001784,"SAFCO Bag Chairs, Adjustable",FURNITURE,Chairs
FUR-CH-10001784,"SAFCO Steel Folding Chair, Set of Two",FURNITURE,Chairs
FUR-CH-10001797,"Safco Chair Connectors, 6/Carton",FURNITURE,Chairs
FUR-CH-10001802,"Novimex Rocking Chair, Black",FURNITURE,Chairs
FUR-CH-10001802,Hon Every-Day Chair Series Swivel Task Chairs,FURNITURE,Chairs
FUR-CH-10001831,"Novimex Rocking Chair, Set of Two",FURNITURE,Chairs
FUR-CH-10001854,Office Star - Professional Matrix Back Chair with 2-to-1 Synchro Tilt and Mesh Fabric Seat,FURNITURE,Chairs
FUR-CH-10001891,Global Deluxe Office Fabric Chairs,FURNITURE,Chairs
FUR-CH-10001973,Office Star Flex Back Scooter Chair with White Frame,FURNITURE,Chairs
FUR-CH-10002017,SAFCO Optional Arm Kit for Workspace Cribbage Stacking Chair,FURNITURE,Chairs
FUR-CH-10002024,HON 5400 Series Task Chairs for Big and Tall,FURNITURE,Chairs
FUR-CH-10002044,"Office Star - Contemporary Task Swivel chair with 2-way adjustable arms, Plum",FURNITURE,Chairs
FUR-CH-10002045,"SAFCO Bag Chairs, Red",FURNITURE,Chairs
FUR-CH-10002060,"SAFCO Rocking Chair, Adjustable",FURNITURE,Chairs
FUR-CH-10002073,Hon Olson Stacker Chairs,FURNITURE,Chairs
FUR-CH-10002084,Hon Mobius Operator's Chair,FURNITURE,Chairs
FUR-CH-10002126,Hon Deluxe Fabric Upholstered Stacking Chairs,FURNITURE,Chairs
FUR-CH-10002152,"Hon Bag Chairs, Set of Two",FURNITURE,Chairs
FUR-CH-10002209,"Novimex Chairmat, Red",FURNITURE,Chairs
FUR-CH-10002212,"Novimex Swivel Stool, Adjustable",FURNITURE,Chairs
FUR-CH-10002297,"Novimex Bag Chairs, Set of Two",FURNITURE,Chairs
FUR-CH-10002304,"Global Stack Chair without Arms, Black",FURNITURE,Chairs
FUR-CH-10002317,Global Enterprise Series Seating Low-Back Swivel/Tilt Chairs,FURNITURE,Chairs
FUR-CH-10002320,Hon Pagoda Stacking Chairs,FURNITURE,Chairs
FUR-CH-10002331,Hon 4700 Series Mobuis Mid-Back Task Chairs with Adjustable Arms,FURNITURE,Chairs
FUR-CH-10002335,Hon GuestStacker Chair,FURNITURE,Chairs
