PRODUCT_ID,PRODUCT_NAME,CATEGORY,SUB_CATEGORY
OFF-ST-10001526,Iceberg Mobile Mega Data/Printer Cart,OFFICE SUPPLIES,Storage
OFF-ST-10001558,Acco Perma 4000 Stacking Storage Drawers,OFFICE SUPPLIES,Storage
OFF-ST-10001576,"Tenex Folders, Blue",OFFICE SUPPLIES,Storage
OFF-ST-10001580,Super Decoflex Portable Personal File,OFFICE SUPPLIES,Storage
OFF-ST-10001590,"Tenex Personal Project File with Scoop Front Design, Black",OFFICE SUPPLIES,Storage
OFF-ST-10001627,Eldon Jumbo ProFile Portable File Boxes Graphite/Black,OFFICE SUPPLIES,Storage
OFF-ST-10001648,"Tenex Shelving, Blue",OFFICE SUPPLIES,Storage
OFF-ST-10001713,"Gould Plastics 9-Pocket Panel Bin, 18-3/8w x 5-1/4d x 20-1/2h, Black",OFFICE SUPPLIES,Storage
OFF-ST-10001719,"Tenex Trays, Industrial",OFFICE SUPPLIES,Storage
OFF-ST-10001729,"Tenex Lockers, Single Width",OFFICE SUPPLIES,Storage
OFF-ST-10001752,"Tenex Shelving, Wire Frame",OFFICE SUPPLIES,Storage
OFF-ST-10001780,Tennsco 16-Compartment Lockers with Coat Rack,OFFICE SUPPLIES,Storage
OFF-ST-10001809,Fellowes Officeware Wire Shelving,OFFICE SUPPLIES,Storage
OFF-ST-10001837,"SAFCO Mobile Desk Side File, Wire Frame",OFFICE SUPPLIES,Storage
OFF-ST-10001932,Fellowes Staxonsteel Drawer Files,OFFICE SUPPLIES,Storage
OFF-ST-10001963,Tennsco Regal Shelving Units,OFFICE SUPPLIES,Storage
OFF-ST-10002011,Smead Adjustable Mobile File Trolley with Lockable Top,OFFICE SUPPLIES,Storage
OFF-ST-10002182,"Iris 3-Drawer Stacking Bin, Black",OFFICE SUPPLIES,Storage
OFF-ST-10002205,File Shuttle I and Handi-File,OFFICE SUPPLIES,Storage
OFF-ST-10002214,X-Rack File for Hanging Folders,OFFICE SUPPLIES,Storage
OFF-ST-10002276,Safco Steel Mobile File Cart,OFFICE SUPPLIES,Storage
OFF-ST-10002289,"Safco Wire Cube Shelving System, For Use as 4 or 5 14"" Cubes, Black",OFFICE SUPPLIES,Storage
OFF-ST-10002292,"Sauder Facets Collection Locker/File Cabinet, Sky Alder Finish",OFFICE SUPPLIES,Storage
OFF-ST-10002301,Tennsco Commercial Shelving,OFFICE SUPPLIES,Storage
OFF-ST-10002344,"Carina 42""Hx23 3/4""W Media Storage Unit",OFFICE SUPPLIES,Storage
OFF-ST-10002352,Iris Project Case,OFFICE SUPPLIES,Storage
OFF-ST-10002370,"Sortfiler Multipurpose Personal File Organizer, Black",OFFICE SUPPLIES,Storage
OFF-ST-10002399,"Tenex Folders, Single Width",OFFICE SUPPLIES,Storage
OFF-ST-10002406,Pizazz Global Quick File,OFFICE SUPPLIES,Storage
OFF-ST-10002444,Recycled Eldon Regeneration Jumbo File,OFFICE SUPPLIES,Storage
OFF-ST-10002485,Rogers Deluxe File Chest,OFFICE SUPPLIES,Storage
OFF-ST-10002486,Eldon Shelf Savers Cubes and Bins,OFFICE SUPPLIES,Storage
OFF-ST-10002554,Tennsco Industrial Shelving,OFFICE SUPPLIES,Storage
OFF-ST-10002574,"SAFCO Commercial Wire Shelving, Black",OFFICE SUPPLIES,Storage
OFF-ST-10002583,Fellowes Neat Ideas Storage Cubes,OFFICE SUPPLIES,Storage
OFF-ST-10002615,"Dual Level, Single-Width Filing Carts",OFFICE SUPPLIES,Storage
OFF-ST-10002743,SAFCO Boltless Steel Shelving,OFFICE SUPPLIES,Storage
OFF-ST-10002756,"Tennsco Stur-D-Stor Boltless Shelving, 5 Shelves, 24"" Deep, Sand",OFFICE SUPPLIES,Storage
OFF-ST-10002790,Safco Industrial Shelving,OFFICE SUPPLIES,Storage
OFF-ST-10002957,Sterilite Show Offs Storage Containers,OFFICE SUPPLIES,Storage
OFF-ST-10002974,"Trav-L-File Heavy-Duty Shuttle II, Black",OFFICE SUPPLIES,Storage
OFF-ST-10003020,"Tenex Lockers, Industrial",OFFICE SUPPLIES,Storage
OFF-ST-10003058,Eldon Mobile Mega Data Cart  Mega Stackable  Add-On Trays,OFFICE SUPPLIES,Storage
OFF-ST-10003123,Fellowes Bases and Tops For Staxonsteel/High-Stak Systems,OFFICE SUPPLIES,Storage
OFF-ST-10003208,Adjustable Depth Letter/Legal Cart,OFFICE SUPPLIES,Storage
OFF-ST-10003282,"Advantus 10-Drawer Portable Organizer, Chrome Metal Frame, Smoke Drawers",OFFICE SUPPLIES,Storage
OFF-ST-10003295,"Tenex Lockers, Blue",OFFICE SUPPLIES,Storage
OFF-ST-10003306,Letter Size Cart,OFFICE SUPPLIES,Storage
OFF-ST-10003324,Belkin OmniView SE Rackmount Kit,OFFICE SUPPLIES,Storage
OFF-ST-10003327,Akro-Mils 12-Gallon Tote,OFFICE SUPPLIES,Storage
OFF-ST-10003442,Eldon Portable Mobile Manager,OFFICE SUPPLIES,Storage
OFF-ST-10003455,"Tenex File Box, Personal Filing Tote with Lid, Black",OFFICE SUPPLIES,Storage
OFF-ST-10003470,"Tennsco Snap-Together Open Shelving Units, Starter Sets and Add-On Units",OFFICE SUPPLIES,Storage
OFF-ST-10003479,"Eldon Base for stackable storage shelf, platinum",OFFICE SUPPLIES,Storage
OFF-ST-10003572,Portfile Personal File Boxes,OFFICE SUPPLIES,Storage
OFF-ST-10003638,Mobile Personal File Cube,OFFICE SUPPLIES,Storage
OFF-ST-10003641,Space Solutions Industrial Galvanized Steel Shelving.,OFFICE SUPPLIES,Storage
OFF-ST-10003656,Safco Industrial Wire Shelving,OFFICE SUPPLIES,Storage
OFF-ST-10003692,Recycled Steel Personal File for Hanging File Folders,OFFICE SUPPLIES,Storage
OFF-ST-10003716,Tennsco Double-Tier Lockers,OFFICE SUPPLIES,Storage
OFF-ST-10003722,Project Tote Personal File,OFFICE SUPPLIES,Storage
OFF-ST-10003805,"24 Capacity Maxi Data Binder Racks, Pearl",OFFICE SUPPLIES,Storage
OFF-ST-10003816,Fellowes High-Stak Drawer Files,OFFICE SUPPLIES,Storage
OFF-ST-10003994,"Belkin 19"" Center-Weighted Shelf, Gray",OFFICE SUPPLIES,Storage
OFF-ST-10003996,"Letter/Legal File Tote with Clear Snap-On Lid, Black Granite",OFFICE SUPPLIES,Storage
OFF-ST-10004123,Safco Industrial Wire Shelving System,OFFICE SUPPLIES,Storage
OFF-ST-10004180,Safco Commercial Shelving,OFFICE SUPPLIES,Storage
OFF-ST-10004186,"Stur-D-Stor Shelving, Vertical 5-Shelf: 72""H x 36""W x 18 1/2""D",OFFICE SUPPLIES,Storage
OFF-ST-10004258,Portable Personal File Box,OFFICE SUPPLIES,Storage
OFF-ST-10004337,"SAFCO Commercial Wire Shelving, 72h",OFFICE SUPPLIES,Storage
OFF-ST-10004340,"Fellowes Mobile File Cart, Black",OFFICE SUPPLIES,Storage
OFF-ST-10004459,Tennsco Single-Tier Lockers,OFFICE SUPPLIES,Storage
OFF-ST-10004507,Advantus Rolling Storage Box,OFFICE SUPPLIES,Storage
OFF-ST-10004634,"Personal Folder Holder, Ebony",OFFICE SUPPLIES,Storage
OFF-ST-10004804,"Belkin 19"" Vented Equipment Shelf, Black",OFFICE SUPPLIES,Storage
OFF-ST-10004835,Plastic Stacking Crates & Casters,OFFICE SUPPLIES,Storage
OFF-ST-10004946,Desktop 3-Pocket Hot File,OFFICE SUPPLIES,Storage
OFF-ST-10004950,"Tenex Personal Filing Tote With Secure Closure Lid, Black/Frost",OFFICE SUPPLIES,Storage
OFF-ST-10004950,Acco Perma 3000 Stacking Storage Drawers,OFFICE SUPPLIES,Storage
OFF-ST-10004963,Eldon Gobal File Keepers,OFFICE SUPPLIES,Storage
OFF-STI-10000114,"Stiletto Letter Opener, High Speed",OFFICE SUPPLIES,Supplies
OFF-STI-10000144,"Stiletto Box Cutter, Steel",OFFICE SUPPLIES,Supplies
OFF-STI-10000286,"Stiletto Ruler, Steel",OFFICE SUPPLIES,Supplies
OFF-STI-10000305,"Stiletto Shears, High Speed",OFFICE SUPPLIES,Supplies
OFF-STI-10000388,"Stiletto Scissors, Serrated",OFFICE SUPPLIES,Supplies
OFF-STI-10000697,"Stiletto Ruler, High Speed",OFFICE SUPPLIES,Supplies
OFF-STI-10000856,"Stiletto Shears, Easy Grip",OFFICE SUPPLIES,Supplies
OFF-STI-10000937,"Stiletto Scissors, High Speed",OFFICE SUPPLIES,Supplies
OFF-STI-10001136,"Stiletto Letter Opener, Easy Grip",OFFICE SUPPLIES,Supplies
OFF-STI-10001162,"Stiletto Letter Opener, Steel",OFFICE SUPPLIES,Supplies
OFF-STI-10001651,"Stiletto Shears, Steel",OFFICE SUPPLIES,Supplies
OFF-STI-10001743,"Stiletto Scissors, Easy Grip",OFFICE SUPPLIES,Supplies
OFF-STI-10001955,"Stiletto Box Cutter, Easy Grip",OFFICE SUPPLIES,Supplies
OFF-STI-10001957,"Stiletto Ruler, Serrated",OFFICE SUPPLIES,Supplies
OFF-STI-10002040,"Stiletto Ruler, Easy Grip",OFFICE SUPPLIES,Supplies
OFF-STI-10002245,"Stiletto Shears, Serrated",OFFICE SUPPLIES,Supplies
OFF-STI-10002262,"Stiletto Box Cutter, High Speed",OFFICE SUPPLIES,Supplies
OFF-STI-10002519,"Stiletto Trimmer, High Speed",OFFICE SUPPLIES,Supplies
OFF-STI-10002716,"Stiletto Box Cutter, Serrated",OFFICE SUPPLIES,Supplies
OFF-STI-10003148,"Stiletto Trimmer, Serrated",OFFICE SUPPLIES,Supplies
OFF-STI-10003234,"Stiletto Trimmer, Steel",OFFICE SUPPLIES,Supplies
OFF-STI-10003510,"Stiletto Trimmer, Easy Grip",OFFICE SUPPLIES,Supplies
OFF-STI-10004202,"Stiletto Scissors, Steel",OFFICE SUPPLIES,Supplies
OFF-SU-10000151,High Speed Automatic Electric Letter Opener,OFFICE SUPPLIES,Supplies
OFF-SU-10000157,Compact Automatic Electric Letter Opener,OFFICE SUPPLIES,Supplies
OFF-SU-10000381,Acme Forged Steel Scissors with Black Enamel Handles,OFFICE SUPPLIES,Supplies
OFF-SU-10000432,Acco Side-Punched Conventional Columnar Pads,OFFICE SUPPLIES,Supplies
OFF-SU-10000646,Premier Automatic Letter Opener,OFFICE SUPPLIES,Supplies
OFF-SU-10000898,"Acme Hot Forged Carbon Steel Scissors with Nickel-Plated Handles, 3 7/8"" Cut, 8""L",OFFICE SUPPLIES,Supplies
OFF-SU-10000952,Fiskars Home & Office Scissors,OFFICE SUPPLIES,Supplies
OFF-SU-10001066,"Kleencut Box Cutter, Easy Grip",OFFICE SUPPLIES,Supplies
OFF-SU-10001086,"Fiskars Scissors, Easy Grip",OFFICE SUPPLIES,Supplies
OFF-SU-10001165,Acme Elite Stainless Steel Scissors,OFFICE SUPPLIES,Supplies
OFF-SU-10001212,Kleencut Forged Office Shears by Acme United Corporation,OFFICE SUPPLIES,Supplies
OFF-SU-10001218,Fiskars Softgrip Scissors,OFFICE SUPPLIES,Supplies
OFF-SU-10001574,Acme Value Line Scissors,OFFICE SUPPLIES,Supplies
OFF-SU-10001657,"Acme Box Cutter, High Speed",OFFICE SUPPLIES,Supplies
OFF-SU-10001664,Acme Office Executive Series Stainless Steel Trimmers,OFFICE SUPPLIES,Supplies
OFF-SU-10002189,Acme Rosewood Handle Letter Opener,OFFICE SUPPLIES,Supplies
OFF-SU-10002301,Serrated Blade or Curved Handle Hand Letter Openers,OFFICE SUPPLIES,Supplies
OFF-SU-10002503,Acme Preferred Stainless Steel Scissors,OFFICE SUPPLIES,Supplies
OFF-SU-10002522,Acme Kleen Earth Office Shears,OFFICE SUPPLIES,Supplies
OFF-SU-10002537,Acme Box Cutter Scissors,OFFICE SUPPLIES,Supplies
OFF-SU-10002557,Fiskars Spring-Action Scissors,OFFICE SUPPLIES,Supplies
OFF-SU-10002573,"Acme 10"" Easy Grip Assistive Scissors",OFFICE SUPPLIES,Supplies
OFF-SU-10002881,Martin Yale Chadless Opener Electric Letter Opener,OFFICE SUPPLIES,Supplies
OFF-SU-10003002,Letter Slitter,OFFICE SUPPLIES,Supplies
OFF-SU-10003505,Premier Electric Letter Opener,OFFICE SUPPLIES,Supplies
OFF-SU-10003567,Stiletto Hand Letter Openers,OFFICE SUPPLIES,Supplies
OFF-SU-10003936,Acme Serrated Blade Letter Opener,OFFICE SUPPLIES,Supplies
OFF-SU-10004115,Acme Stainless Steel Office Snips,OFFICE SUPPLIES,Supplies
OFF-SU-10004231,Acme Tagit Stainless Steel Antibacterial Scissors,OFFICE SUPPLIES,Supplies
OFF-SU-10004261,"Fiskars 8"" Scissors, 2/Pack",OFFICE SUPPLIES,Supplies
OFF-SU-10004290,"Acme Design Line 8"" Stainless Steel Bent Scissors w/Champagne Handles, 3-1/8"" Cut",OFFICE SUPPLIES,Supplies
OFF-SU-10004498,Martin-Yale Premier Letter Opener,OFFICE SUPPLIES,Supplies
OFF-SU-10004661,Acme Titanium Bonded Scissors,OFFICE SUPPLIES,Supplies
OFF-SU-10004664,Acme Softgrip Scissors,OFFICE SUPPLIES,Supplies
OFF-SU-10004737,Acme Design Stainless Steel Bent Scissors,OFFICE SUPPLIES,Supplies
OFF-SU-10004768,Acme Kleencut Forged Steel Scissors,OFFICE SUPPLIES,Supplies
OFF-SU-10004782,"Elite 5"" Scissors",OFFICE SUPPLIES,Supplies
OFF-SU-10004884,Acme Galleria Hot Forged Steel Scissors with Colored Handles,OFFICE SUPPLIES,Supplies
TEC-AC-10000007,"SanDisk Router, USB",TECHNOLOGY,Accessories
TEC-AC-10000023,"Maxell 74 Minute CD-R Spindle, 50/Pack",TECHNOLOGY,Accessories
TEC-AC-10000025,"SanDisk Memory Card, Bluetooth",TECHNOLOGY,Accessories
TEC-AC-10000051,"Logitech Memory Card, USB",TECHNOLOGY,Accessories
TEC-AC-10000057,Microsoft Natural Ergonomic Keyboard 4000,TECHNOLOGY,Accessories
TEC-AC-10000086,"Logitech Mouse, USB",TECHNOLOGY,Accessories
TEC-AC-10000089,"SanDisk Router, Bluetooth",TECHNOLOGY,Accessories
TEC-AC-10000097,"Belkin Mouse, Programmable",TECHNOLOGY,Accessories
TEC-AC-10000097,"Memorex Keyboard, Bluetooth",TECHNOLOGY,Accessories
TEC-AC-10000109,Sony Micro Vault Click 16 GB USB 2.0 Flash Drive,TECHNOLOGY,Accessories
TEC-AC-10000110,"Belkin Numeric Keypad, Bluetooth",TECHNOLOGY,Accessories
TEC-AC-10000111,"SanDisk Mouse, USB",TECHNOLOGY,Accessories
TEC-AC-10000115,"SanDisk Keyboard, USB",TECHNOLOGY,Accessories
TEC-AC-10000140,"Enermax Numeric Keypad, Bluetooth",TECHNOLOGY,Accessories
TEC-AC-10000151,"SanDisk Flash Drive, Erganomic",TECHNOLOGY,Accessories
TEC-AC-10000152,"Logitech Flash Drive, Erganomic",TECHNOLOGY,Accessories
TEC-AC-10000158,Sony 64GB Class 10 Micro SDHC R40 Memory Card,TECHNOLOGY,Accessories
TEC-AC-10000170,"Memorex Keyboard, Programmable",TECHNOLOGY,Accessories
TEC-AC-10000171,"Verbatim 25 GB 6x Blu-ray Single Layer Recordable Disc, 25/Pack",TECHNOLOGY,Accessories
TEC-AC-10000199,Kingston Digital DataTraveler 8GB USB 2.0,TECHNOLOGY,Accessories
TEC-AC-10000212,"SanDisk Memory Card, Erganomic",TECHNOLOGY,Accessories
TEC-AC-10000218,"SanDisk Numeric Keypad, USB",TECHNOLOGY,Accessories
TEC-AC-10000221,"Belkin Memory Card, Programmable",TECHNOLOGY,Accessories
TEC-AC-10000244,"Memorex Router, USB",TECHNOLOGY,Accessories
TEC-AC-10000254,"Belkin Keyboard, Programmable",TECHNOLOGY,Accessories
TEC-AC-10000254,"Enermax Flash Drive, Bluetooth",TECHNOLOGY,Accessories
TEC-AC-10000263,"Belkin Mouse, USB",TECHNOLOGY,Accessories
TEC-AC-10000264,"Memorex Memory Card, Erganomic",TECHNOLOGY,Accessories
TEC-AC-10000269,"Memorex Numeric Keypad, USB",TECHNOLOGY,Accessories
TEC-AC-10000271,"Enermax Router, Erganomic",TECHNOLOGY,Accessories
TEC-AC-10000284,"Belkin Flash Drive, Bluetooth",TECHNOLOGY,Accessories
TEC-AC-10000290,Sabrent 4-Port USB 2.0 Hub,TECHNOLOGY,Accessories
TEC-AC-10000303,Logitech M510 Wireless Mouse,TECHNOLOGY,Accessories
TEC-AC-10000317,"Logitech Memory Card, Programmable",TECHNOLOGY,Accessories
TEC-AC-10000332,"Logitech Keyboard, USB",TECHNOLOGY,Accessories
TEC-AC-10000335,"Belkin Router, Programmable",TECHNOLOGY,Accessories
TEC-AC-10000336,"Enermax Mouse, Bluetooth",TECHNOLOGY,Accessories
TEC-AC-10000342,"Logitech Numeric Keypad, Programmable",TECHNOLOGY,Accessories
TEC-AC-10000354,"Belkin Numeric Keypad, USB",TECHNOLOGY,Accessories
TEC-AC-10000358,Imation Secure Drive + Hardware Encrypted USB flash drive - 16 GB,TECHNOLOGY,Accessories
TEC-AC-10000376,"Memorex Router, Bluetooth",TECHNOLOGY,Accessories
TEC-AC-10000387,KeyTronic KT800P2 - Keyboard - Black,TECHNOLOGY,Accessories
TEC-AC-10000397,"Enermax Mouse, USB",TECHNOLOGY,Accessories
TEC-AC-10000397,"Perixx PERIBOARD-512B, Ergonomic Split Keyboard",TECHNOLOGY,Accessories
TEC-AC-10000398,"SanDisk Memory Card, Programmable",TECHNOLOGY,Accessories
TEC-AC-10000420,"Belkin Router, USB",TECHNOLOGY,Accessories
TEC-AC-10000420,Logitech G500s Laser Gaming Mouse with Adjustable Weight Tuning,TECHNOLOGY,Accessories
TEC-AC-10000450,"Enermax Keyboard, USB",TECHNOLOGY,Accessories
TEC-AC-10000462,"Logitech Keyboard, Programmable",TECHNOLOGY,Accessories
TEC-AC-10000474,"Logitech Flash Drive, USB",TECHNOLOGY,Accessories
TEC-AC-10000474,Kensington Expert Mouse Optical USB Trackball for PC or Mac,TECHNOLOGY,Accessories
TEC-AC-10000487,SanDisk Cruzer 4 GB USB Flash Drive,TECHNOLOGY,Accessories
TEC-AC-10000494,"Logitech Numeric Keypad, USB",TECHNOLOGY,Accessories
TEC-AC-10000499,"Memorex Memory Card, USB",TECHNOLOGY,Accessories
TEC-AC-10000501,"Enermax Router, Programmable",TECHNOLOGY,Accessories
TEC-AC-10000510,"SanDisk Flash Drive, Bluetooth",TECHNOLOGY,Accessories
TEC-AC-10000512,"Enermax Keyboard, Bluetooth",TECHNOLOGY,Accessories
TEC-AC-10000521,"Verbatim Slim CD and DVD Storage Cases, 50/Pack",TECHNOLOGY,Accessories
TEC-AC-10000530,"Logitech Memory Card, Bluetooth",TECHNOLOGY,Accessories
TEC-AC-10000540,"Logitech Mouse, Erganomic",TECHNOLOGY,Accessories
TEC-AC-10000580,Logitech G13 Programmable Gameboard with LCD Display,TECHNOLOGY,Accessories
TEC-AC-10000596,"Enermax Memory Card, Erganomic",TECHNOLOGY,Accessories
TEC-AC-10000598,"Belkin Flash Drive, USB",TECHNOLOGY,Accessories
TEC-AC-10000633,"Enermax Memory Card, USB",TECHNOLOGY,Accessories
TEC-AC-10000639,"Belkin Router, Bluetooth",TECHNOLOGY,Accessories
TEC-AC-10000642,"Logitech Flash Drive, Bluetooth",TECHNOLOGY,Accessories
TEC-AC-10000657,"Enermax Memory Card, Bluetooth",TECHNOLOGY,Accessories
TEC-AC-10000682,Kensington K72356US Mouse-in-a-Box USB Desktop Mouse,TECHNOLOGY,Accessories
TEC-AC-10000692,"Logitech Keyboard, Erganomic",TECHNOLOGY,Accessories
TEC-AC-10000710,Maxell DVD-RAM Discs,TECHNOLOGY,Accessories
TEC-AC-10000736,Logitech G600 MMO Gaming Mouse,TECHNOLOGY,Accessories
TEC-AC-10000763,"SanDisk Memory Card, USB",TECHNOLOGY,Accessories
TEC-AC-10000766,"SanDisk Mouse, Bluetooth",TECHNOLOGY,Accessories
TEC-AC-10000815,"Enermax Flash Drive, Erganomic",TECHNOLOGY,Accessories
TEC-AC-10000827,"SanDisk Keyboard, Programmable",TECHNOLOGY,Accessories
TEC-AC-10000844,Logitech Gaming G510s - Keyboard,TECHNOLOGY,Accessories
TEC-AC-10000860,"Enermax Numeric Keypad, USB",TECHNOLOGY,Accessories
TEC-AC-10000861,"SanDisk Router, Erganomic",TECHNOLOGY,Accessories
TEC-AC-10000863,"Enermax Numeric Keypad, Erganomic",TECHNOLOGY,Accessories
TEC-AC-10000865,WD My Passport Ultra 500GB Portable External Hard Drive,TECHNOLOGY,Accessories
TEC-AC-10000866,"Belkin Router, Erganomic",TECHNOLOGY,Accessories
TEC-AC-10000883,"Belkin Mouse, Bluetooth",TECHNOLOGY,Accessories
TEC-AC-10000892,NETGEAR N750 Dual Band Wi-Fi Gigabit Router,TECHNOLOGY,Accessories
TEC-AC-10000896,"Belkin Numeric Keypad, Erganomic",TECHNOLOGY,Accessories
TEC-AC-10000926,NETGEAR RangeMax WNR1000 Wireless Router,TECHNOLOGY,Accessories
TEC-AC-10000927,Anker Ultrathin Bluetooth Wireless Keyboard Aluminum Cover with Stand,TECHNOLOGY,Accessories
TEC-AC-10000990,Imation Bio 2GB USB Flash Drive Imation Corp,TECHNOLOGY,Accessories
TEC-AC-10000991,Sony Micro Vault Click 8 GB USB 2.0 Flash Drive,TECHNOLOGY,Accessories
TEC-AC-10001013,Logitech ClearChat Comfort/USB Headset H390,TECHNOLOGY,Accessories
TEC-AC-10001022,"SanDisk Flash Drive, USB",TECHNOLOGY,Accessories
TEC-AC-10001030,"Memorex Flash Drive, Erganomic",TECHNOLOGY,Accessories
TEC-AC-10001075,"Belkin Keyboard, USB",TECHNOLOGY,Accessories
TEC-AC-10001076,"Memorex Keyboard, USB",TECHNOLOGY,Accessories
TEC-AC-10001089,"Enermax Keyboard, Erganomic",TECHNOLOGY,Accessories
TEC-AC-10001090,"Enermax Mouse, Programmable",TECHNOLOGY,Accessories
TEC-AC-10001090,Micro Innovations Wireless Classic Keyboard with Mouse,TECHNOLOGY,Accessories
TEC-AC-10001100,"Logitech Router, Bluetooth",TECHNOLOGY,Accessories
TEC-AC-10001101,Sony 16GB Class 10 Micro SDHC R40 Memory Card,TECHNOLOGY,Accessories
TEC-AC-10001109,Logitech Trackman Marble Mouse,TECHNOLOGY,Accessories
TEC-AC-10001114,Microsoft Wireless Mobile Mouse 4000,TECHNOLOGY,Accessories
TEC-AC-10001142,First Data FD10 PIN Pad,TECHNOLOGY,Accessories
TEC-AC-10001172,"Logitech Numeric Keypad, Erganomic",TECHNOLOGY,Accessories
TEC-AC-10001197,"Logitech Memory Card, Erganomic",TECHNOLOGY,Accessories
TEC-AC-10001254,"Enermax Memory Card, Programmable",TECHNOLOGY,Accessories
TEC-AC-10001266,Memorex Micro Travel Drive 8 GB,TECHNOLOGY,Accessories
TEC-AC-10001267,Imation 32GB Pocket Pro USB 3.0 Flash Drive - 32 GB - Black - 1 P ...,TECHNOLOGY,Accessories
TEC-AC-10001274,"Belkin Memory Card, Bluetooth",TECHNOLOGY,Accessories
TEC-AC-10001278,"Enermax Flash Drive, USB",TECHNOLOGY,Accessories
TEC-AC-10001284,Enermax Briskie RF Wireless Keyboard and Mouse Combo,TECHNOLOGY,Accessories
TEC-AC-10001295,"Memorex Memory Card, Bluetooth",TECHNOLOGY,Accessories
TEC-AC-10001311,"Belkin Keyboard, Erganomic",TECHNOLOGY,Accessories
TEC-AC-10001314,Case Logic 2.4GHz Wireless Keyboard,TECHNOLOGY,Accessories
TEC-AC-10001352,"SanDisk Numeric Keypad, Bluetooth",TECHNOLOGY,Accessories
TEC-AC-10001355,"Memorex Router, Programmable",TECHNOLOGY,Accessories
TEC-AC-10001383,Logitech Wireless Touch Keyboard K400,TECHNOLOGY,Accessories
TEC-AC-10001402,"Memorex Numeric Keypad, Bluetooth",TECHNOLOGY,Accessories
TEC-AC-10001407,"Belkin Mouse, Erganomic",TECHNOLOGY,Accessories
TEC-AC-10001432,Enermax Aurora Lite Keyboard,TECHNOLOGY,Accessories
TEC-AC-10001438,"SanDisk Flash Drive, Programmable",TECHNOLOGY,Accessories
TEC-AC-10001441,"SanDisk Mouse, Erganomic",TECHNOLOGY,Accessories
TEC-AC-10001445,Imation USB 2.0 Swivel Flash Drive USB flash drive - 4 GB - Pink,TECHNOLOGY,Accessories
TEC-AC-10001465,SanDisk Cruzer 64 GB USB Flash Drive,TECHNOLOGY,Accessories
TEC-AC-10001486,"Belkin Flash Drive, Programmable",TECHNOLOGY,Accessories
TEC-AC-10001539,Logitech G430 Surround Sound Gaming Headset with Dolby 7.1 Technology,TECHNOLOGY,Accessories
TEC-AC-10001542,SanDisk Cruzer 16 GB USB Flash Drive,TECHNOLOGY,Accessories
TEC-AC-10001552,Logitech K350 2.4Ghz Wireless Keyboard,TECHNOLOGY,Accessories
TEC-AC-10001553,"Memorex 25GB 6X Branded Blu-Ray Recordable Disc, 15/Pack",TECHNOLOGY,Accessories
TEC-AC-10001566,"Logitech Router, Erganomic",TECHNOLOGY,Accessories
TEC-AC-10001590,Dell Slim USB Multimedia Keyboard,TECHNOLOGY,Accessories
TEC-AC-10001592,"Enermax Flash Drive, Programmable",TECHNOLOGY,Accessories
TEC-AC-10001606,Logitech Wireless Performance Mouse MX for PC and Mac,TECHNOLOGY,Accessories
TEC-AC-10001608,"Memorex Flash Drive, USB",TECHNOLOGY,Accessories
TEC-AC-10001616,"SanDisk Numeric Keypad, Erganomic",TECHNOLOGY,Accessories
TEC-AC-10001635,KeyTronic KT400U2 - Keyboard - Black,TECHNOLOGY,Accessories
TEC-AC-10001639,"Belkin Flash Drive, Erganomic",TECHNOLOGY,Accessories
TEC-AC-10001666,"Memorex Numeric Keypad, Erganomic",TECHNOLOGY,Accessories
TEC-AC-10001688,"Enermax Keyboard, Programmable",TECHNOLOGY,Accessories
TEC-AC-10001705,"Logitech Keyboard, Bluetooth",TECHNOLOGY,Accessories
TEC-AC-10001714,Logitech MX Performance Wireless Mouse,TECHNOLOGY,Accessories
TEC-AC-10001735,"Logitech Mouse, Bluetooth",TECHNOLOGY,Accessories
TEC-AC-10001745,"Memorex Flash Drive, Programmable",TECHNOLOGY,Accessories
TEC-AC-10001767,SanDisk Ultra 64 GB MicroSDHC Class 10 Memory Card,TECHNOLOGY,Accessories
TEC-AC-10001772,Memorex Mini Travel Drive 16 GB USB 2.0 Flash Drive,TECHNOLOGY,Accessories
TEC-AC-10001791,"Memorex Mouse, Programmable",TECHNOLOGY,Accessories
TEC-AC-10001792,"Logitech Mouse, Programmable",TECHNOLOGY,Accessories
TEC-AC-10001838,Razer Tiamat Over Ear 7.1 Surround Sound PC Gaming Headset,TECHNOLOGY,Accessories
TEC-AC-10001874,Logitech Wireless Anywhere Mouse MX for PC and Mac,TECHNOLOGY,Accessories
TEC-AC-10001908,Logitech Wireless Headset h800,TECHNOLOGY,Accessories
TEC-AC-10001949,"Enermax Router, Bluetooth",TECHNOLOGY,Accessories
TEC-AC-10001956,Microsoft Arc Touch Mouse,TECHNOLOGY,Accessories
TEC-AC-10001990,"Enermax Router, USB",TECHNOLOGY,Accessories
TEC-AC-10001990,Kensington Orbit Wireless Mobile Trackball for PC and Mac,TECHNOLOGY,Accessories
TEC-AC-10001995,"Logitech Router, USB",TECHNOLOGY,Accessories
TEC-AC-10001998,Logitech LS21 Speaker System - PC Multimedia - 2.1-CH - Wired,TECHNOLOGY,Accessories
TEC-AC-10002001,Logitech Wireless Gaming Headset G930,TECHNOLOGY,Accessories
TEC-AC-10002006,Memorex Micro Travel Drive 16 GB,TECHNOLOGY,Accessories
TEC-AC-10002015,"Logitech Router, Programmable",TECHNOLOGY,Accessories
TEC-AC-10002017,"Belkin Memory Card, Erganomic",TECHNOLOGY,Accessories
TEC-AC-10002018,AmazonBasics 3-Button USB Wired Mouse,TECHNOLOGY,Accessories
TEC-AC-10002025,"Memorex Flash Drive, Bluetooth",TECHNOLOGY,Accessories
TEC-AC-10002049,Logitech G19 Programmable Gaming Keyboard,TECHNOLOGY,Accessories
TEC-AC-10002049,Plantronics Savi W720 Multi-Device Wireless Headset System,TECHNOLOGY,Accessories
TEC-AC-10002076,Microsoft Natural Keyboard Elite,TECHNOLOGY,Accessories
TEC-AC-10002086,"SanDisk Keyboard, Erganomic",TECHNOLOGY,Accessories
TEC-AC-10002134,Rosewill 107 Normal Keys USB Wired Standard Keyboard,TECHNOLOGY,Accessories
TEC-AC-10002167,Imation 8gb Micro Traveldrive Usb 2.0 Flash Drive,TECHNOLOGY,Accessories
TEC-AC-10002170,"Logitech Flash Drive, Programmable",TECHNOLOGY,Accessories
TEC-AC-10002217,Imation Clip USB flash drive - 8 GB,TECHNOLOGY,Accessories
TEC-AC-10002218,"Memorex Keyboard, Erganomic",TECHNOLOGY,Accessories
TEC-AC-10002221,"Memorex Mouse, Bluetooth",TECHNOLOGY,Accessories
TEC-AC-10002253,Imation Bio 8GB USB Flash Drive Imation Corp,TECHNOLOGY,Accessories
TEC-AC-10002257,"Logitech Numeric Keypad, Bluetooth",TECHNOLOGY,Accessories
TEC-AC-10002305,KeyTronic E03601U1 - Keyboard - Beige,TECHNOLOGY,Accessories
TEC-AC-10002323,SanDisk Ultra 32 GB MicroSDHC Class 10 Memory Card,TECHNOLOGY,Accessories
TEC-AC-10002331,"Maxell 74 Minute CDR, 10/Pack",TECHNOLOGY,Accessories
TEC-AC-10002335,"Belkin Memory Card, USB",TECHNOLOGY,Accessories
TEC-AC-10002335,Logitech Media Keyboard K200,TECHNOLOGY,Accessories
TEC-AC-10002345,HP Standard 104 key PS/2 Keyboard,TECHNOLOGY,Accessories
TEC-AC-10002370,Maxell CD-R Discs,TECHNOLOGY,Accessories
TEC-AC-10002380,Sony 8GB Class 10 Micro SDHC R40 Memory Card,TECHNOLOGY,Accessories
TEC-AC-10002399,SanDisk Cruzer 32 GB USB Flash Drive,TECHNOLOGY,Accessories
TEC-AC-10002402,Razer Kraken PRO Over Ear PC and Music Headset,TECHNOLOGY,Accessories
TEC-AC-10002473,Maxell 4.7GB DVD-R,TECHNOLOGY,Accessories
TEC-AC-10002522,"Memorex Router, Erganomic",TECHNOLOGY,Accessories
TEC-AC-10002550,"Memorex 25GB 6X Branded Blu-Ray Recordable Disc, 30/Pack",TECHNOLOGY,Accessories
TEC-AC-10002550,Maxell 4.7GB DVD-RW 3/Pack,TECHNOLOGY,Accessories
TEC-AC-10002558,Imation Swivel Flash Drive USB flash drive - 8 GB,TECHNOLOGY,Accessories
TEC-AC-10002567,Logitech G602 Wireless Gaming Mouse,TECHNOLOGY,Accessories
TEC-AC-10002600,Belkin QODE FastFit Bluetooth Keyboard,TECHNOLOGY,Accessories
TEC-AC-10002637,Logitech VX Revolution Cordless Laser Mouse for Notebooks (Black),TECHNOLOGY,Accessories
TEC-AC-10002647,"Logitech Wireless Boombox Speaker - portable - wireless, wired",TECHNOLOGY,Accessories
TEC-AC-10002718,Belkin Standard 104 key USB Keyboard,TECHNOLOGY,Accessories
TEC-AC-10002756,"SanDisk Keyboard, Bluetooth",TECHNOLOGY,Accessories
TEC-AC-10002799,"Memorex Memory Card, Programmable",TECHNOLOGY,Accessories
TEC-AC-10002800,Plantronics Audio 478 Stereo USB Headset,TECHNOLOGY,Accessories
TEC-AC-10002842,WD My Passport Ultra 2TB Portable External Hard Drive,TECHNOLOGY,Accessories
